New column 0,New column 1
Responsabilités,"Le Conseil du Trésor fait fonction d'employeur et c'est à lui qu'incombe la responsabilité générale d'administrer la fonction publique fédérale en temps de grève.

Le Secrétariat du Conseil du Trésor est chargé de fournir au Conseil du Trésor les renseignements et les conseils pertinents sur la grève, de communiquer les directives de l'employeur et de donner des conseils aux ministères à propos des questions liées aux relations de travail. Il est également chargé des relations avec les syndicats afin de chercher à résoudre le différend. Ses autres responsabilités sont décrites ailleurs dans la politique.

Il incombe aux ministères de veiller à ce que les employés, les biens immobiliers et les installations du gouvernement soient dûment protégés, tout en maintenant le service au niveau le plus élevé possible, selon leurs propres plans de grève.

Les divisions des relations de travail des ministères sont chargées, pendant la grève proprement dite, tout comme avant et après la grève, de fournir conseils et aide aux gestionnaires pour leur permettre de bien s'acquitter de cette fonction et de maintenir la liaison entre la haute direction des ministères et la Division des relations de travail du Secrétariat du Conseil du Trésor. Ils sont également chargées de maintenir des relations efficaces avec les employés et les représentants syndicaux et de fournir des rapports précis et opportuns au Secrétariat du Conseil du Trésor.

Justice Canada fournit des conseils au Conseil du Trésor et aux ministères et représente leurs intérêts aux fins de l'application des mesures judiciaires prises en vertu du Code criminel."
Suivi,"Le Secrétariat du Conseil du Trésor évalue la performance des ministères quant à leur façon de gérer les grèves d'après les critères suivants :

la qualité et l'exactitude des rapports fournis au Secrétariat du Conseil du Trésor;
le contrôle des activités des piquets de grève;
la capacité du ministère d'appliquer des principes judicieux de relations de travail pour assurer une réaction efficace à la grève."
Documents de référence,"La Loi sur le relations de travail dans la fonction publique
Les conventions collectives pertinentes."
Demandes de renseignements,"Division des relations de travail
Direction de la politique des ressources humaines
Secrétariat du Conseil du Trésor"
