New column 0,New column 1
Objectif de la politique,Assurer une réaction efficace de l'employeur en cas de grève dans la fonction publique fédérale.
Énoncé de la politique,"La Loi sur les relations de travail dans la fonction publique (LRTFP) reconnaît le droit de grève et prescrit les conditions rendant illégale la participation à une grève. (A.102)

L'employeur reconnaît que le droit de grève prévu par la LRTFP est une option légitime du processus de négociation, et il tente, dans la mesure du possible, de maintenir le service et les opérations, de protéger le personnel, les propriétés et les installations du gouvernement, et de poursuivre des relations constructives avec les syndicats et les employés participant à une grève légale, pendant et après la grève.

Lorsqu'une grève est terminée, l'employeur s'efforce de normaliser la situation le plus tôt possible en cherchant à rétablir de bonnes relations avec les syndicats et les employés qui reprennent le travail, et en maintenant l'horaire normal de travail dans la mesure du possible.

En cas de grève illégale, l'employeur prend les mesures appropriées pour qu'elle cesse le plus tôt possible."
Application,"La présente politique s'applique à tous les éléments de la fonction publique du Canada dont Sa Majesté, représentée par le Conseil du Trésor, est l'employeur; c.-à-d. ceux qui sont énumérés dans la LRTFP, Annexe I, Partie I."
