New column 0,New column 1
Exigences de la politique,"Grèves légales
1. Planification préalable

Dès qu'on sait qu'une ou plusieurs unités de négociation ont choisi le processus de conciliation comme mode de règlement des différends, les ministères doivent commencer leur planification et leur préparation en fonction de la possibilité d'une grève des employés de l'unité ou des unités de négociation en cause. À cette fin, ils doivent prendre les mesures suivantes :

1.1 déterminer les services et les fonctions qu'imposent la sûreté ou la sécurité du public;

1.2 revoir tous les postes dans l'unité(s) de négociation et identifier ceux qui devraient être désignés et ceux qui ne le devraient pas au plus tard trois (3) mois avant la date à laquelle l'avis de négocier peut être donné conformément à l'article 78.1(4) de la LRTFP;

1.3 déterminer les autres fonctions et services habituellement assurés par des fonctionnaires de l'unité ou des unités de négociation en cause, et qu'il faudra maintenir en temps de grève, en faisant appel aux fonctionnaires exclus disponibles et aux autres ressources disponibles telles les personnes employées à temps partiel qui ne sont pas habituellement tenues de travailler plus du tiers des heures régulières et les personnes employées à titre occasionnel ou temporaire nommées pour une période de moins de trois mois;

1.4 former des fonctionnaires exclus, dans la mesure du possible, à l'exercice de fonctions autres que celles qu'ils accomplissent normalement. Cette forme de préparation peut permettre de maintenir certaines fonctions et certains services qui seraient autrement interrompus pendant une grève;

1.5 revoir les mesures de sécurité à prendre pour faire fonctionner les appareils avec un effectif réduit ou nouvellement formé, et obtenir des permis pour les fonctionnaires qualifiés qui doivent faire fonctionner un appareil dont l'exploitation exige un permis;

1.6 désigner un représentant exclu des services de sécurité du ministère pour faire partie des comités de planification en cas de grève de l'administration centrale du ministère et établir un programme de sécurité comportant l'examen des zones de sécurité critiques et du matériel d'urgence disponible; déterminer la protection nécessaire et disponible de la part des pompiers, de la police et d'autres forces de sûreté et organiser des patrouilles régulières de sécurité. L'examen des zones critiques de sécurité devrait comprendre des descriptions ou des plans des locaux du ministère ou les deux, au cas où il faudrait recourir ultérieurement à de tels documents pour étayer une demande d'injonction;

1.7 examiner la possibilité d'établir des centres d'opération de grève régionaux et à l'administration centrale;

1.8 lorsqu'un ministère a décidé de ne pas établir de centres régionaux ou locaux d'opérations de grève, il appartient au gestionnaire local exclu :

d'examiner les zones de sécurité critiques et le matériel de sécurité disponible (l'examen devrait comprendre des descriptions ou des plans des locaux du ministère ou les deux, au cas où il faudrait recourir ultérieurement à de tels documents pour étayer une demande d'injonction);
de déterminer la protection nécessaire et disponible de la part des pompiers, de la police et des autres forces de sûreté, et d'organiser des patrouilles de sécurité;
de planifier la répartition des tâches aux fonctionnaires exclus, y compris les fonctions liées à la grève;
d'avertir les clients et les autres personnes touchées de la possibilité d'une grève (par exemple les fournisseurs, les entrepreneurs et le personnel d'entretien);

1.9 distribuer aux gestionnaires hiérarchiques un guide sur la préparation à une grève, décrivant les procédures opérationnelles à suivre pendant une grève et les responsabilités et les droits fondamentaux des fonctionnaires en grève, ceux des fonctionnaires membres de l'unité de négociation qui ne font pas la grève, ceux des fonctionnaires désignés, ceux des gestionnaires et ceux des fonctionnaires membres des unités de négociation qui ne sont pas en situation de grève;

1.10 maintenir un contact étroit et régulier avec le représentant compétent de Justice Canada et déterminer de façon précise ce qui sera requis, au cas où il faudrait présenter ultérieurement une demande d'injonction. Justice Canada peut en outre fournir des conseils à propos de la compétence des divers services policiers. Il importe également de communiquer avec les services de police et d'incendie avant la grève, afin de s'assurer de leur collaboration pour garantir la sécurité ainsi que l'accès aux immeubles;

1.11 établir des comités interministériels de grève après avoir pris conseil auprès des directeurs des relations de travail des ministères, dans les immeubles ou les lieux de travail occupés par plus d'un ministère. Il appartient au comité de déterminer les mesures à prendre pour assurer l'accès ininterrompu à l'immeuble pendant une grève. Le président du comité doit prendre les mesures indiquées en 1.10. Le comité devrait comprendre la personne responsable de la sécurité de l'immeuble ainsi que des gestionnaires des ministères qui ont l'autorité d'envisager de fermer l'immeuble en cas d'urgence;

1.12 mettre à date les listes de dirigeants et de représentants syndicaux à travers le pays étant donné que cette information sera possiblement requise lors de demandes d'injonctions.

1.13 considérer la possibilité d'assigner d'autres fonctions aux fonctionnaires membres d'une unité de négociation qui n'est pas en grève et dont le travail normal a été réduit en raison d'une grève. Dans l'impossibilité de le faire par suite du prolongement de la grève, par exemple, les ministères doivent songer à prendre les mesures suivantes :

déterminer si les fonctionnaires désirent prendre leurs congés annuels;
mettre les fonctionnaires en congé forcé non payé.

Avant de recourir à cette dernière solution, il faut consulter le Secrétariat du Conseil du Trésor.

2. Mesures à prendre avant une grève

Au cours des semaines qui précèdent une grève légale éventuelle, il faut informer les gestionnaires exclus :

2.1 de leur rôle et de leurs responsabilités si l'on prévoit qu'ils seront différents de ceux qu'ils assument normalement

2.2 du caractère extrêmement délicat d'une grève et de la nécessité de bien peser toutes les déclarations faites avant, pendant et après la grève;

2.3 du rôle et des responsabilités des fonctionnaires qui occupent un poste désigné;

2.4 de la nécessité d'informer tous les fonctionnaires de la distinction à faire entre les activités de piquetage légales et illégales et de communiquer ce qui suit aux fonctionnaires membres d'une unité de négociation qui n'a pas le droit de faire la grève :

qu'ils sont tenus de se présenter au travail, sauf avis contraire;
ce qu'ils doivent faire s'ils ne peuvent pas franchir un piquet de grève;
que les conventions collectives encore en vigueur lient les fonctionnaires membres des unités de négociation qui ne sont pas en grève.

Remarque :

Ces renseignements doivent être communiqués aux employés au moyen d'un avis normalisé (appendice C). Cet avis doit être placé sur les tableaux d'affichage où se trouvent habituellement les documents intéressant les employés. Il faut attirer particulièrement l'attention des employés sur cet avis lorsqu'une grève est imminente.

2.5 de la nécessité d'examiner toutes les demandes de congé préalablement autorisées qui avaient été présentées par des fonctionnaires appartenant à l'unité de négociation susceptible de déclencher la grève dans les cas où la durée du congé risque de se prolonger et de coïncider avec la période prévue de la grève. Les demandes de congé préalablement autorisées de même que les nouvelles demandes de congé ne doivent être autorisées que dans des circonstances spéciales. Dans tous les cas, il faut se garder d'approuver une demande de congé présentée par un fonctionnaire appartenant à l'unité de négociation qui menace de déclencher la grève, si le congé en question ne ferait que permettre à l'intéressé d'échapper aux conséquences de la grève;

2.6 de la nécessité de déterminer s'il y a lieu de rappeler les fonctionnaires membres de l'unité de négociation en grève, qui sont en voyage et en grève, à leur lieu d'affectation, ou bien, s'il y a lieu de laisser les intéressés en voyage, conformément à la Directive du Conseil du Trésor sur les voyages, sans toutefois les rémunérer pour le temps pendant lequel ils ne travaillent pas. Un fonctionnaire en grève qu'on rappelle à son lieu d'affectation est déclaré en situation de voyage pendant son trajet de retour, mais en aucun cas, la durée de ce voyage ne doit être considérée comme du temps de travail;

2.7 de la nécessité d'examiner le cas de tous les télétravailleurs qui sont membres de l'unité ou des unités de négociation en grève. Les ententes de télétravail en vigueur peuvent être reconduites ou de nouvelles ententes approuvées, en autant que la direction accepte que ces dernières demeurent conformes aux principes qui sous-tendent la politique sur le télétravail. Les normes de l'employeur concernant la sécurité, y compris celles visant la sécurité personnelle des employés et la protection du matériel et d'autres éléments d'actif du gouvernement, doivent être respectées. On doit tenir compte de facteurs semblables aux fins de l'approbation des ententes pendant la période consécutive à la grève;

2.8 de la nécessité d'examiner le cas de tous les fonctionnaires handicapés qui continuent à travailler, y compris la nature des fonctions qu'ils exercent, afin de planifier un changement de leur lieu de travail ou de prévoir d'autres modalités de travail, lorsqu'il y a lieu de craindre pour leur sécurité personnelle en cas de piquetage massif ou indiscipliné; il y a lieu de songer à la possibilité de conclure des ententes de télétravail, sans perdre de vue les normes de sécurité de l'employeur ni le caractère volontaire de la participation de l'employé au projet de télétravail. La direction doit faire preuve d'une prudence particulière pour évaluer la situation sur les piquets de grève et pour permettre aux fonctionnaires handicapés qui ne font pas la grève de traverser les piquets de grève ou pour les relever de l'obligation d'entrer au travail.

3. Mesures à prendre lorsqu'une grève est imminente

Dès qu'il est évident qu'une grève est sur le point d'éclater, les ministères sont tenus de prendre sur-le-champ les mesures ci-après :

3.1 songer à envoyer des gestionnaires exclus aux emplacements touchés par la grève, afin de maintenir les services à un niveau déterminé par le ministère; s'assurer de la bonne garde des installations et des immeubles gouvernementaux; être prêts, en leur qualité de représentants de la direction, à rencontrer les représentants de la section locale du syndicat pour régler tous les problèmes locaux auxquels donne lieu le déclenchement de la grève (notamment en cas de piquetage : les participants, l'endroit et les façons de procéder); de tenir le journal de grève et de fournir des renseignements à l'administration centrale des ministères;

3.2 mettre en marche le centre d'opérations en temps de grève de l'administration centrale des ministères dont l'effectif est constitué d'agents des relations de travail et d'autres fonctionnaires exclus;

3.3 le directeur des relations de travail doit informer le centre d'opérations en temps de grève du Secrétariat du Conseil du Trésor ou le directeur de la Négociation collective de la mise sur pied du centre d'opérations de l'administration centrale du ministère, et la liaison avec le Secrétariat du Conseil du Trésor doit débuter;

3.4 les centres d'opérations régionaux et locaux doivent être mis en marche, et la liaison doit être établie entre ces centres et le centre d'opérations de l'administration centrale des ministères.

Grève illégales
1. Mesures à prendre dès qu'une grève illégale devient probable

Dès qu'une grève illégale semble devoir éclater, l'administration centrale des ministères doit en être informée sur-le-champ.

1.1 Le directeur des Relations de travail doit veiller à prendre les mesures suivantes sur-le-champ :

1.1.1 avertir le directeur de la Négociation collective de la Division des relations de travail du Secrétariat du Conseil du Trésor. Une fois averti, le directeur communiquera avec le chef de la direction du syndicat pour lui demander de prendre immédiatement les mesures nécessaires pour garantir le respect de la convention collective. Il pourra mettre en marche le centre d'opérations du Secrétariat du Conseil du Trésor.

1.1.2. les dirigeants syndicaux sont informés de la situation et du fait que la convention collective est encore en vigueur;

1.1.3 charger la direction de l'endroit où la grève illégale est susceptible de se produire des tâches suivantes :

rappeler aux fonctionnaires et aux représentants de la section locale du syndicat que la convention collective est encore en vigueur;
informer les fonctionnaires et le syndicat que la procédure de règlement des griefs et d'arbitrage constitue la méthode appropriée de résolution des problèmes et que, par leurs gestes, les fonctionnaires peuvent s'exposer à des mesures disciplinaires;
signaler que la LRTFP interdit les grèves illégales, et énoncer les amendes et les différents recours qu'elle prévoit (voir article 105 de la LRTFP).

Remarque :

On peut utiliser diverses méthodes pour joindre les fonctionnaires, selon les circonstances du moment : communication verbale directe, appels téléphoniques, télégrammes, affichage d'avis, lettres, etc.

1.1.4 lorsque les circonstances sont suffisamment graves, la direction locale est immédiatement chargée des tâches suivantes :

avertir les agents de sécurité et examiner les zones de sécurité critiques;
avertir le service de sûreté ou le service d'incendie ou les deux, au besoin;
songer à assigner des fonctions aux fonctionnaires exclus de l'emplacement touché par la grève de façon à maintenir les services au niveau déterminé au préalable par le ministère, et de s'acquitter des tâches liées à la grève, notamment rencontrer les dirigeants locaux du syndicat ou les représentants des fonctionnaires ou les deux; déterminer les faits et la ou les causes de la grève; tenter d'inciter les fonctionnaires à retourner au travail, et consigner les renseignements liés à la grève de la façon décrite à la section relative au journal de grève.

1.2 Si les circonstances le justifient, l'administration centrale des ministères peut décider de mettre en marche certains de leurs centres d'opérations. Elle doit alors en informer le Secrétariat du Conseil du Trésor.

2. Mesures à prendre lorsqu'une grève illégale a été déclenchée

Une fois qu'une grève illégale a été déclenchée, les ministères doivent prendre immédiatement les mesures suivantes :

2.1 les directeurs des relations de travail doivent veiller à avertir les cadres, là où a lieu la grève illégale, de prendre les mesures ci-après :

2.1.1 informer les fonctionnaires et les représentants de la section locale du syndicat que la convention collective est toujours en vigueur et que les fonctionnaires sont tenus de retourner au travail;

2.1.2 informer les fonctionnaires et le syndicat que la procédure de règlement des griefs et d'arbitrage constitue la méthode appropriée de résolution des problèmes et que, par leurs gestes, les fonctionnaires s'exposent à des mesures disciplinaires;

2.1.3 signaler que la LRTFP interdit les grèves illégales et énoncer les amendes et les différents recours qu'elle prévoit (article 105 de la LRTFP);

2.1.4 aviser le service de sécurité du ministère et, dans les cas suffisamment graves, examiner les zones de sécurité critiques et avertir le service de police et le service d'incendie;

2.1.5 assigner des fonctions aux fonctionnaires exclus, y compris des tâches liées à la grève, et, dans les cas où il est nécessaire et possible de le faire, faire envoyer des gestionnaires exclus de l'extérieur à l'endroit où la grève a lieu;

2.1.6 avertir les clients et les autres personnes touchées (par exemple, les fournisseurs, les entrepreneurs et le personnel d'entretien);

2.1.7 ouvrir une enquête sur la grève illégale pour déterminer ce qui suit :

ses répercussions sur les opérations;
les fonctionnaires qui y participent;
les activités menées par le piquet de grève, le cas échéant (nature du piquetage : heure, date et endroit);
toute action concertée des fonctionnaires à l'intérieur ou à l'extérieur des locaux du gouvernement;

2.1.8 cesser de rémunérer les fonctionnaires en grève, qui sont absents ou ont interrompu leurs services.

2.2 Lorsque les mesures prises par les ministères pour rappeler les employés au travail restent sans résultats, il se peut que le ministère doive se résoudre à demander au Secrétariat du Conseil du Trésor de présenter une demande d'injonction de retour au travail.

2.3 Si les circonstances le justifient, l'administration centrale des ministères peut décider de mettre en marche certains de leurs centres d'opérations.

Centres d'opérations en temps de grève

On doit voir à établir le réseau des centres ministériels d'opérations pour faciliter la circulation de l'information entre les lieux de la grève, l'administration centrale des ministères et le Secrétariat du Conseil du Trésor.

Le Secrétariat du Conseil du Trésor a habituellement besoin de renseignements précis et exacts sur les répercussions opérationnelles de la grève, le nombre de fonctionnaires en grève et au travail et sur la nature du piquetage effectué près des immeubles gouvernementaux. D'autres exigences en matière d'information, notamment le calendrier de présentation des rapports, sont également déterminées par le Secrétariat du Conseil du Trésor.

1 Centre d'opérations du Secrétariat du Conseil du Trésor

Le Secrétariat du Conseil du Trésor affecte du personnel au fonctionnement d'un centre d'opérations avant une grève légale et dans certains cas avant une grève illégale. La liaison avec le Conseil du Trésor s'effectue à l'aide de lignes téléphoniques spéciales et d'autres moyens de communication.

Centres d'opérations des ministères

2.1 Administration centrale

Lorsqu'une grève est imminente, les ministères doivent mettre en marche le centre d'opérations de leur administration centrale et y affecter des agents de relations de travail ainsi que d'autres fonctionnaires exclus chargés d'assurer la liaison avec les centres régionaux du ministère et le Secrétariat du Conseil du Trésor.

2.2 Centres régionaux et locaux

Selon la façon dont ils sont organisés, les ministères peuvent vouloir établir un certain nombre de centres d'opérations régionaux et locaux afin de faire face aux grèves tant légales qu'illégales. Qu'un centre d'opérations officiel soit ou non établi, il doit y avoir assez de fonctionnaires exclus au niveau local et régional pour exécuter les fonctions suivantes dans le cas d'une grève :

protéger les propriétés et les installations du gouvernement;
maintenir les opérations et les services au niveau établi par le ministère;
communiquer rapidement des renseignements pertinents et précis au centre d'opération de grève de l'administration centrale du ministère;
consigner les renseignements susceptibles de permettre de prendre des mesures légales ou disciplinaires ou les deux, au besoin.
3. Établissement d'un centre d'opérations de ministère (administrations centrales, centres régionaux et locaux)

Il faut posséder les éléments suivants pour pouvoir mettre sur pied un centre d'opérations :

un nombre suffisant de fonctionnaires exclus pour faire fonctionner le centre 24 heures sur 24, au besoin;
des services téléphoniques et autres services de communications, y compris des appareils photo et des magnétoscopes;
une liste des noms, des numéros de téléphone (à domicile et au bureau) et des adresses des membres de tous les centres d'opérations régionaux et locaux ou des gestionnaires exclus responsables des opérations régionales ou locales, là où il n'a pas été établi de centre d'opérations;
des meubles, de la nourriture, et d'autres fournitures pour accommoder les fonctionnaires qui peuvent être appelés à travailler de longues heures y compris la nuit, et une petite caisse pour les besoins urgents;
un journal de grève;
des journaux, des récepteurs radio et de télévision pour suivre de près les communiqués concernant la grève.
Journal de grève - Grèves légales ou illégales
Pendant une grève, les centres d'opération du Secrétariat du Conseil du Trésor et des ministères doivent tenir un journal de grève. Dans certains cas, notamment celui d'une grève illégale que l'on prévoit de courte durée, ou à certains endroits où il a été décidé de ne pas établir de centre d'opération de grève, les mêmes renseignements sont consignés par un fonctionnaire exclu affecté à cette tâche.
Tout incident susceptible d'avoir quelque importance est consigné et documenté chaque jour, de manière à constituer une preuve convenable pour justifier des mesures disciplinaires, une demande d'injonction ou toute autre mesure judiciaire.
Les journaux de grève doivent être gardés en lieu sûr dans les centres d'opération de grève ou, en l'absence de tels centres, dans les bureaux locaux, régionaux ou de l'administration centrale.
Le journal de grève doit contenir les renseignements normalisés suivants :
le nombre de fonctionnaires en grève;
le nombre de fonctionnaires qui pourraient légalement être en grève, mais qui sont au travail;
le nombre de fonctionnaires désignés, absents du travail;
les piquets de grève surtout aux heures d'entrée au travail (endroit, nombre de personnes en cause, durée et nature du piquetage; p. ex., paisible, incidents sur la ligne de piquetage, piquetage en masse, obstruction à l'accès aux installations gouvernementales). Les incidents et les tentatives d'obstruction devraient être filmés et on devrait obtenir sans tarder des déclarations de témoins, si possible.
des rapports sur les répercussions opérationnelles de la grève;
des copies des ordonnances d'injonction;
tout autre renseignement pertinent, y compris les communications ministérielles avec le grand public et/ou les médias et les reportages importants diffusés par les médias.
Relations avec les médias
Le Secrétariat du Conseil du Trésor se charge de faire des déclarations aux médias et à la population en général, concernant les négociations et les questions connexes, y compris l'évolution générale de la grève. Les ministères, pour leur part, se chargent des déclarations concernant les opérations et l'impact sur les services, en consultation avec leurs agents d'information.
Pendant une grève, les ministères et le Secrétariat du Conseil du Trésor doivent être en mesure de communiquer rapidement avec les médias et le public et de répondre à leurs questions. S'ils ne répondent pas rapidement et en connaissance de cause aux journalistes, au grand public et aux parlementaires, ou ne rectifient pas les informations erronées provenant d'autres sources, la confiance que la population met dans la fonction publique risque d'en subir le préjudice.
Les ministères doivent veiller à faire transmettre rapidement à leurs centres d'opérations des administrations centrales et au Secrétariat du Conseil du Trésor les renseignements de dernière heure y compris des données précises et l'impact des activités de grève sur les opérations, au cas où il faudrait établir des communications externes à l'échelle du pays.

Remarque :

Dans bien des cas, les journalistes régionaux s'enquièrent de la situation ailleurs dans le ministère et à la grandeur de la fonction publique. Les ministères devraient donc communiquer régulièrement les renseignements de dernière heure à leurs gestionnaires locaux, en particulier à ceux qui sont responsables des bureaux où le public est servi.

Piquetage
Le piquetage en soi n'est pas visé par la définition du terme «grève». La loi permet le piquetage paisible auquel se livrent des fonctionnaires en grève ou pendant leur temps libre afin d'obtenir ou de communiquer une information.
Recourir à la force, faire des menaces de violence, bloquer l'accès aux locaux, violer ou endommager la propriété du gouvernement, empêcher le public ou les fonctionnaires d'entrer dans les locaux ou d'en sortir sont autant de gestes susceptibles de constituer des délits en vertu du Code criminel. Les fonctionnaires qui agissent ainsi s'exposent à une injonction du tribunal ou à des poursuites au criminel. Si, après l'injonction, elles continuent leurs activités, elles peuvent être poursuivies pour outrage au tribunal. Des mesures disciplinaires pouvant aller jusqu'au licenciement peuvent également être prises.
Les sifflets, les huées ou les jurons des piqueteurs en grève ne sauraient en soi être considérés comme des moyens illégaux de refuser l'accès aux locaux d'un ministère.
Durant la grève, les ministères doivent observer jusqu'à quel point les corps policiers parviennent à assurer la liberté d'accès aux immeubles. Si les grévistes continuent d'entraver l'accès aux immeubles, il faut communiquer de nouveau avec les corps policiers afin d'obtenir leur aide. Il faut tenir en tout temps un dossier où l'on inscrit les événements au fur et à mesure qu'ils se produisent, en précisant notamment les endroits où les piqueteurs manifestent, leur nombre, leur identité et leur conduite, les rapports de fonctionnaires qu'on a essayé d'empêcher d'entrer dans l'immeuble, les demandes d'aide adressées aux corps policiers, y compris un résumé détaillé des conversations avec les représentants des corps policiers, et des observations relatives aux mesures prises par eux pour empêcher les grévistes de nuire aux fonctionnaires, y compris toute preuve d'incapacité des corps policiers de rester maîtres de la situation. Ces renseignements peuvent s'avérer essentiels lors d'une demande d'injonction contre les piqueteurs.

Il est également important de déterminer quels sont les fonctionnaires qui ont participé à un piquet de grève illégal. Si l'on soupçonne que certains fonctionnaires proviennent d'autres lieux de travail, il faut demander l'aide du comité de liaison des lieux de travail visés afin d'identifier les piqueteurs, lorsqu'il est raisonnable de le faire. Les ministères doivent s'assurer qu'ils ont l'adresse exacte de tous les employés pour faciliter la signification des documents judiciaires. On peut également demander aux ministères de participer à la signification des documents judiciaires aux fonctionnaires.

Dans les immeubles occupés par plus d'un ministère le comité interministériel de grève est chargé d'exercer les fonctions décrites ci-dessus.

Dans les cas où des activités gouvernementales sont menées dans des locaux de l'État qui ne servent habituellement pas à des fins de démonstration ni de manifestation publique, il est interdit aux fonctionnaires en grève d'y faire du piquetage, lorsque le mode d'expression est incompatible avec la vocation de ces lieux.

Lorsque les opérations ou activités gouvernementales sont menées dans des lieux qui ont toujours été considérés comme des «endroits publics», le piquetage paisible et légal peut être autorisé. Le piquetage illégal, qui consiste essentiellement en des gestes d'obstruction ou de violence, ne doit pas être autorisé, et il y a lieu d'y mettre fin par l'intervention des corps policiers ou l'obtention d'une injonction, ou par les deux.

Les ministères occupant des locaux commerciaux en qualité de locataires ne peuvent pas prendre pour acquis qu'ils sont totalement protégés contre le piquetage. Dans les cas de ce genre, il faut suivre de près les activités de piquetage à l'extérieur de l'immeuble, de façon à être en mesure de demander rapidement une injonction visant à limiter le piquetage si nécessaire. De plus, les ministères sont tenus de prendre des mesures de sécurité supplémentaires à l'intérieur de l'immeuble afin d'empêcher les piqueteurs de pénétrer dans les secteurs occupés par le ministère, en passant par les secteurs commerciaux.

Injonctions
Le Secrétariat du Conseil du Trésor, après avoir consulté les ministères, décide s'il y a lieu de recourir à des mesures judiciaires, notamment des poursuites ou des injonctions de retour au travail. Les ministères décident s'il y a lieu de demander des injonctions pour restreindre le piquetage et d'intenter des poursuites en dommages-intérêts, après avoir consulté l'employeur. Quelle que soit la ligne de conduite qu'ils adoptent, le Secrétariat et les ministères doivent élaborer une stratégie globale conjointe avant, pendant et après une grève, et entretenir des rapports étroits entre eux.
Dans les conflits de travail, on peut recourir aux injonctions aux fins suivantes :
empêcher une grève qui est illégale ou qui pourrait l'être;
empêcher ou limiter les piquets de grève illégaux.
Pour obtenir une injonction, le demandeur doit convaincre le tribunal :
qu'il y a apparence de droit, à la lumière des faits que le demandeur risque de subir des dommages irréparables s'il ne peut obtenir gain de cause et que le préjudice ne pourrait pas être compensé par des dommages-intérêts.
que le tort dont souffrira le demandeur si l'injonction n'est pas accordée est plus important que les dommages qui risquent d'être causés au défendeur si l'injonction est accordée;
que la situation est urgente et qu'il n'existe pas d'autres moyens d'y remédier
Procédure

4.1 En règle générale, les injonctions accordées lors de conflits du travail sont interlocutoires; c.-à-d. que l'ordonnance demandée vise une période temporaire, avant que la cause ne soit entendue. La preuve qui appuie une injonction interlocutoire est habituellement présentée sous forme d'affidavit, soit une déclaration assermentée de personnes qui sont au courant des faits pertinents. On peut joindre à l'affidavit des documents pertinents (voir le spécimen d'affidavit, Appendice E, Lignes directrices 1 et 2). Par conséquent, lorsqu'ils prévoient la possibilité de recours à une injonction, les ministères doivent être prêts à désigner les personnes qui sont au courant des faits. Il faut demander à ces personnes d'avoir en leur possession tout document qui peut être joint à l'affidavit, y compris une description matérielle élémentaire des locaux du ministère et une description des incidences du piquetage sur les opérations dans les secteurs où auront vraisemblablement lieu les arrêts de travail.

4.2 Dans la plupart des cas, il faut signifier au défendeur intimé, c.à-d. le syndicat ou les grévistes, ou les deux, les documents qui seront présentés devant les tribunaux, au moins une journée avant l'audience. Il est donc essentiel que les ministères identifient de manière précise au moins quelques-uns des fonctionnaires qui participent aux activités que l'on désire faire interdire, et donnent leur adresse exacte. On peut également demander aux ministères de prêter main-forte pour la signification des documents aux défendeurs.

4.3 Si l'injonction est accordée, le tribunal émet une ordonnance. C'est au demandeur qu'il incombe de voir à ce que les fonctionnaires concernés soient mis au courant de cette ordonnance. À cette fin, les ministères doivent en distribuer une copie au plus grand nombre de fonctionnaires possible. Ils doivent utiliser, de plus, d'autres formes d'avis, comme la publicité par les médias et l'affichage.

Compétence des tribunaux

5.1 La Cour fédérale a le pouvoir d'émettre des injonctions dans le cas où l'action visée constitue une infraction à une loi fédérale (p. ex., lorsqu'une grève contrevient à la Loi sur les relations de travail dans la fonction publique).

Lorsqu'il est question de poursuites judiciaires ou d'injonctions de retour au travail, le secrétaire du Conseil du Trésor, ou la personne qu'il désigne, doit demander officiellement à Justice Canada d'obtenir l'injonction.

5.2 Dans les cas où des piquets de grève sont dressés illégalement, les procédures judiciaires doivent être prises devant la Cour supérieure de la province où il y a des piquets de grève.

Lorsqu'il s'agit de poursuites en dommages-intérêts ou d'une injonction visant à restreindre le piquetage, les ministres des ministères concernés peuvent demander officiellement à Justice Canada d'obtenir l'injonction. De plus, afin d'accélérer les procédures de dédommagement, les ministres peuvent autoriser les sous-chefs des ministères, les premiers dirigeants des organismes, ainsi que les cadres supérieurs des régions à demander à Justice Canada d'entreprendre les poursuites judiciaires.

Toute demande d'injonction doit être accompagnée spécifiquement d'un engagement à faire respecter l'ordonnance d'injonction (voir la lettre type, Appendice E, Ligne directrice 5); c.-à-d. qu'en cas de refus des grévistes de respecter l'ordonnance, il faut appeler la police et déposer les accusations appropriées, notamment le défaut de se conformer à une ordonnance de la cour. La demande d'injonction engage automatiquement le ministère à appuyer le procureur général et ses fonctionnaires dans les poursuites judiciaires qui pourront s'imposer, si les ordonnances du tribunal ne sont pas respectées.

Éléments de preuve

Les éléments de preuve sur lesquels est fondée l'action en justice doivent être rassemblés par les ministères concernés. Ils se rangent dans les deux grandes catégories suivantes :

les témoins,
les documents et les objets

6.1 Témoins

Les témoins présentés par les ministères devraient être des gestionnaires exclus. Il faut leur demander de tenir des notes personnelles sur les événements et les conversations ayant trait aux grèves et au piquetage.

Les événements et les conversations mentionnés dans les notes doivent être des événements et des conversations dont l'auteur a eu personnellement connaissance. L'auteur doit les rédiger au moment des événements ou des conversations ou immédiatement après. Les notes devraient être manuscrites. Si elles sont dactylographiées, l'auteur doit en vérifier l'exactitude immédiatement après la transcription, puis les signer et les dater.

Les notes sont inutiles si elles ne donnent pas des renseignements précis et exacts concernant :

l'identité des personnes;
l'heure et la date des événements ou conversations d'importance, ou les deux;
l'endroit où ces événements ou ces conversations, ou les deux, ont eu lieu.

Selon la procédure judiciaire, les témoins peuvent se référer aux notes originales qu'ils ont prises au moment même des événements, ou le plus tôt possible par la suite.

Les témoins éventuels peuvent aussi prendre des photos et des vidéos. Cependant, les photos et les vidéos des événements entourant une grève ou du piquetage ne doivent pas être prises d'une manière provocante.

6.2 Documents et objets

Outre les témoins, les ministères peuvent se servir de documents et d'autres objets comme preuves dans une poursuite judiciaire. Par exemple, les documents tels les télégrammes, les bulletins d'information et les tracts peuvent être utiles. Les objets comme les pancartes et les affiches peuvent servir de preuves au cours d'un procès. Les ministères devraient conserver tous les documents ou les objets qui tendent à montrer que les fonctionnaires projetaient de déclencher une grève illégale ou ont été invités à le faire. Cela vaut également pour les actes répréhensibles qui se produisent sur les piquets de grève.

Sanctions disciplinaires

La politique de l'employeur sur les «sanctions disciplinaires» s'applique en temps de grève, et la sévérité des mesures disciplinaires prises doit être proportionnée à la nature de l'infraction et des circonstances qui l'entourent. De plus, les mesures disciplinaires reliées aux activités de grève doivent être appliquées de façon relativement uniforme à l'intérieur d'un ministère ou d'une organisation.

Conditions d'emploi
Généralités

Lorsqu'une unité de négociation est en position de grève légale, la convention collective est échue et l'article 52 de la LRTFP (maintien en vigueur des conditions d'emploi) n'est plus en vigueur. Le Conseil du Trésor, en vertu des pouvoirs qui lui sont conférés par la Loi sur la gestion des finances publiques, est habilité à déterminer les conditions d'emploi régissant tous les fonctionnaires membres de l'unité de négociation qui ne font pas la grève, et il peut reconduire les dispositions de la convention échue, les modifier ou établir des conditions d'emploi différentes. Dans la plupart des cas, les conditions d'emploi prescrites par la convention échue sont reconduites par un arrêté de maintien en vigueur. Avant une grève, les ministères seront avisés des conditions d'emploi qui seront en vigueur. L'appendice B décrit les avantages sociaux accordés aux fonctionnaires en grève.

Administration de la paye

Le Groupe de l'administration de la paye de la Division de la classification, parité salariale, information et paye de la Direction de la politique des ressources humaines fournit aux ministères les renseignements sur l'administration de la paye, après avoir consulté la Division des relations de travail.

Le Secrétariat du Conseil du Trésor avertit les bureaux de la paye du moment où les cotisations syndicales doivent cesser d'être perçues pour les fonctionnaires appartenant à une unité de négociation qui a le droit de faire la grève.

Administration des congés

3.1 Congés annuels et congés compensatoires

De façon générale, les fonctionnaires membres d'une unité de négociation qui sont déjà en congé au début d'une grève peuvent poursuivre leur congé, mais il ne faut pas leur permettre de le prolonger. Les fonctionnaires qui participent à une grève, et auxquels on avait accordé des congés coïncidant avec cette grève, ne sont pas autorisés à les prendre.

En général, on ne doit pas accorder de congés annuels ni de congés compensatoires aux employés désignés durant une grève. Cependant, dans des cas exceptionnels, ou dans les ministères où la totalité ou la presque totalité des fonctionnaires appartenant à un groupe professionnel sont désignés, on peut accorder de tels congés.

On ne devrait pas permettre aux employés qui font partie des lignes de piquetage de demeurer en congé.

3.2 Congés de maladie et «autres congés payés ou non payés»

Les fonctionnaires membres d'une unité de négociation en grève qui sont en congé de maladie ou qui bénéficient d'un «autre congé payé ou non payé» avant le début d'une grève, devraient être autorisés à poursuivre leur congé, sous réserve qu'ils continuent à fournir une preuve suffisante pour justifier leur congé. Le gestionnaire délégué peut, à sa discrétion, accorder un congé de maladie ou un «autre congé payé ou non payé» aux employés désignés et aux fonctionnaires membres de l'unité de négociation qui décident d'entrer au travail à la condition qu'ils rencontrent les exigences pour l'octroi du congé. Cependant, on ne doit pas autoriser de congé de maladie ni d'«autre congé payé ou non payé» dans le cas des fonctionnaires en grève.

On ne doit pas accorder aux employés des congés de maladie ni d'«autres congés payés ou non payés» pour les jours durant lesquels ils font partie des lignes de piquetage.

3.3 Congés pour affaires syndicales

On ne doit pas accorder de congés pour affaires syndicales durant une grève aux représentants et aux membres de l'unité de négociation en grève."
