New column 0,New column 1
1. Date d’entrée en vigueur,"1.1

La présente version des lignes directrices comprend des mises à jour qui entrent en vigueur le 1er avril 2022."
2. Objet,"2.1

Fournir des directives aux gestionnaires et aux spécialistes fonctionnels sur la détermination, la collecte, la déclaration et la publication de renseignements sur les marchés."
3. Contexte,"3.1

Dans le cadre du deuxième Plan d’action sur le gouvernement ouvert du Canada, le gouvernement du Canada s’est engagé à la divulgation des données sur la passation de marchés au moyen d’une base de données publique à la fois centralisée et lisible par machine. Cet engagement renforce la divulgation proactive des marchés, faisant état des engagements élargis du gouvernement envers la transparence et la responsabilisation accrue dans le secteur public, annoncés initialement dans le budget fédéral de 2004.

3.2

Les données sur la passation de marchés sont recueillies aux fins suivantes :

renforcer la transparence du processus d’approvisionnement afin de tenir le gouvernement responsable auprès des Canadiens;
respecter les obligations en matière d’établissement de rapports sur les accords d’approvisionnement commerciaux;
évaluer les instruments de politique.
3.3

Les présentes lignes directrices appuient la Directive sur la gestion de l’approvisionnement. L’annexe C.2.1 exige que les cadres supérieurs désignés pour la gestion de l’approvisionnement publient de façon proactive les renseignements sur le contrat conformément à la partie 2 de la Loi sur l’accès à l’information. L’annexe C.2.3 exige aussi que les ministères rendent compte sur les éléments de données du contrat dans le format de données prescrit par le Secrétariat du Conseil du Trésor du Canada.

3.4

Ces lignes directrices appuient également la divulgation publique des exigences en matière de renseignements sur les marchés des entités fédérales et des cabinets des ministres en vertu de la Loi sur l’accès à l’information. Les articles 77 et 86 de cette loi exigent que les cabinets des ministres et les entités fédérales divulguent publiquement les marchés d’une valeur de plus de 10 000 $, une modification apportée à un marché lorsque celle-ci a pour effet de porter la valeur du marché à plus de 10 000 $ et une modification à un marché lorsque celle-ci augmente ou diminue la valeur du marché de plus de 10 000 $."
4. Lignes directrices,"4.1 Détermination des marchés qui doivent faire l’objet d’une divulgation proactive
4.1.1

L’annexe C.2.4.1 de la Directive sur la gestion de l’approvisionnement exige la divulgation publique trimestrielle des renseignements suivants :

un marché dont la valeur est supérieure à 10 000 $;
une modification positive ou négative dont la valeur est supérieure à 10 000 $;
une modification positive qui a une incidence sur la valeur initiale d’un marché, l’augmentant à un montant supérieur à 10 000 $.
4.1.2

L’annexe C.2.5 de la Directive sur la gestion de l’approvisionnement exige un rapport annuel, en fonction de l’année civile, à Services publics et Approvisionnement Canada (SPAC), par courriel à (ncr.gwprs@pwgsc.gc.ca et cc à : ZZPDCDC@tbs-sct.gc.ca ) sur ce qui suit :

un marché dont la valeur est d’au plus 10 000 $;
une modification positive ou négative dont la valeur est d’au plus 10 000 $.
4.1.3

L’annexe C.2.4.2 de la Directive sur la gestion de l’approvisionnement exige la déclaration publique annuelle, au cours d’une année civile, du volume et de la valeur cumulative en dollars d’un marché ou d’une modification positive ou négative dont la valeur est de d’au plus 10 000 $. De plus, elle exige la divulgation du volume et de la valeur cumulative en dollars de toutes les opérations par carte d’achat, peu importe la valeur en dollars.

4.1.4

Une série de modifications à un contrat peut être divulguée comme une seule modification au cours d’une période de déclaration. Sinon, une modification peut être déclarée de façon distincte s’il s’agit d’une pratique courante au sein du ministère.

4.1.5

Il n’est pas nécessaire de divulguer les modifications non financières, sauf s’il est dans l’intérêt public de le faire.

4.1.6

Lorsqu’une option de marché est exercée, elle peut être divulguée à titre de modification. Sinon, la valeur totale du marché, y compris les options, peut être divulguée au moment de l’adjudication du marché.

4.1.7

Une commande subséquente à une offre à commandes ou une entente en matière d’approvisionnement doit être divulguée comme un marché.

4.1.8

Les offres à commandes et les ententes en matière d’approvisionnement ne sont pas des marchés d’approvisionnement, mais elles doivent être divulguées par souci de transparence. Ces ententes doivent être divulguées soit dans le cadre de la divulgation proactive, soit sur un site Web public.

4.1.9

Dans le cas d’un marché comportant des autorisations de tâches
Voir la note en bas de page
1, la valeur totale éventuelle du marché peut être divulguée à la date d’adjudication du marché, à moins qu’il ne soit pas prévu d’utiliser la valeur totale du marché. Dans le dernier cas, chaque autorisation de tâches peut être divulguée individuellement. Lorsque le marché comporte un produit livrable fixe et un autre qui doit être accompagné d’une autorisation de tâches, le ministère peut divulguer le marché et les autorisations de tâches de n’importe quelle façon jugée transparente.

4.1.10

Conformément à la partie 2 de la Loi sur l’accès à l’information, les ministères sont tenus de divulguer les marchés ou les modifications positives et négatives d’une valeur supérieure à 10 000 $, avec quelques rares exceptions. Le ministère n’est pas tenu de divulguer des renseignements sur les marchés qui seraient correctement retenus en réponse à une demande en vertu des articles 80 et 90, contenus dans la partie 1 de la Loi sur l’accès à l’information.

4.1.11

Lorsqu’un ministère détermine qu’il convient de ne pas divulguer de façon proactive les renseignements sur les marchés en vertu du paragraphe 4.1.10 des présentes lignes directrices, il est toujours tenu, conformément à la partie 2 de la Loi sur l’accès à l’information, de divulguer les parties des renseignements sur les marchés qui ne contiennent pas ou qui peuvent raisonnablement être dissociées des renseignements qui peuvent être retenus.

4.1.12

Les éléments suivants seraient habituellement exclus de la déclaration, à moins qu’ils ne constituent des contrats en vertu de la Politique sur la planification et la gestion des investissements :

Les renseignements sur les protocoles d’entente signés avec d’autres ordres de gouvernement ou des gouvernements étrangers;
Les renseignements relatifs aux ententes sur les niveaux de service conclues entre les ministères du gouvernement fédéral et les sociétés d’État.
4.2 Collecte des éléments de données sur les marchés
4.2.1

Les éléments de données aux annexes A et B ont été élaborés afin d’offrir de l’uniformité au public. À titre de pratique exemplaire, on encourage les ministères à suivre l’approche recommandée indiquée aux annexes A et B pour chaque élément de données, si possible. Si l’utilisation de l’approche recommandée n’est pas possible, un ministère peut avoir recours à une pratique courante au sein du ministère aux fins de divulgation. Afin d’assurer l’uniformité pour le public, on recommande aux ministères de s’éloigner des normes ministérielles et d’adopter la norme de déclaration recommandée au fil du temps.

4.3 Publication et déclaration des marchés
4.3.1

À compter de l’année civile 2017, les ministères doivent déclarer leurs données sur les marchés dans le Portail du gouvernement ouvert. Lorsque Services publics et Approvisionnement Canada, Services partagés Canada (SPC) ou un autre ministère ou une société d’État conclut un marché pour le compte d’un autre ministère, c’est au ministère client qu’il incombe de déclarer le marché. SPAC et SPC aideront les organisations clientes en fournissant toute l’information dont ils disposent sur ces marchés par l’intermédiaire du site GCPedia de la division de la politique des acquisitions du SCT dans les cinq jours suivant la fin du trimestre. De plus, l’autorité contractante de SPAC et SPC doit fournir une copie de chaque marché ou modification au ministère client au moment de l’adjudication.

4.3.2

En ce qui concerne les marchés multi ministériels de SPAC et de SPC, les ministères doivent divulguer leur partie uniquement comme contrat ou modification selon la manière dont ils ont été enregistrés dans leurs systèmes ministériels d’approvisionnement ou financiers. Dans le cas d’une offre à commandes ou d’un arrangement en matière d’approvisionnement, il est recommandé que le ministère autorisant l’accord le divulgue.

4.3.3

Ce qui suit doit faire l’objet d’une déclaration :

divulgations publiques trimestrielles des éléments de données, tels que décrits à l’annexe A pour les marchés ainsi que les modifications positives et négatives de plus de 10 000 $, dans un délai de 30 jours après la fin des trois premiers trimestres d’un exercice financier (avril à juin, juillet à septembre, et octobre à décembre) et de 60 jours après la fin du quatrième trimestre;
divulgations publiques annuelles des éléments de données, tels que décrits à l’annexe B pour les marchés ainsi que les modifications positives et négatives d’au plus 10 000 $, au plus tard le 30 mai de l’année civile suivante;
divulgations publiques annuelles à SPAC des éléments de données, tels que décrits à l’annexe A pour les marchés ainsi que les modifications positives et négatives d’au plus 10 000 $, au plus tard le 30 mai de l’année civile suivante.
4.3.4

Si les dates mentionnées ci-dessus sont des jours de fin de semaine ou de congé férié, les ministères peuvent afficher l’information au plus tard le dernier jour ouvrable précédant la fin de semaine ou le jour férié concerné.

4.3.5

Un marché ou une modification n’ayant pas été déclaré au cours de la période de déclaration où il a été attribué peut être déclaré dans la période de déclaration subséquente ou dès que possible. Quand un marché ou une modification est inclus dans une période de déclaration après sa publication, il faut indiquer clairement l’omission dans l’élément de données « commentaires » (consultez l’annexe C).

4.3.6

L’information affichée au cours d’une période de déclaration peut être modifiée pour cette période seulement si une erreur importante a été commise dans les données initiales. On recommande d’indiquer clairement toute information modifiée en tant que telle dans l’élément de données « commentaires » (consultez l’annexe C).

4.3.7

Les ministères doivent fournir un rapport portant la mention « néant » pour une année civile ou un trimestre au cours duquel aucun marché ou aucune modification n’a été divulgué. Il incombe aux ministères de remplir les éléments de données « période de déclaration » et « rapport néant » dans le gabarit de rapport.

4.3.8

Les ministères sont tenus de déclarer leurs données selon le format de données prévu dans les zones nouvelles et révisées de l’Annexe A, dès qu’il sera possible de le faire sur le plan administratif, mais pas au delà du quatrième trimestre de l’exercice 2021‑2022 dans le cas des modifications et des marchés accordés à compter du 1 janvier 2022. Dans l’intervalle, les ministères continueront à utiliser l’ancien format de données pour indiquer des renseignements dans les zones de données existantes, jusqu’à ce qu’ils puissent assurer la transition au nouveau format de données.

4.3.9

Les ministères et organismes énumérés à l’Annexe E devront ajouter les nouveaux éléments de données précisés à l’Annexe A, les points 37 à 40 des rapports de divulgation proactive provisoire. Il est recommandé que les ministères débutent la déclaration des éléments de données énoncés à l’Annexe E une fois que les fonctionnalités nécessaires auront été intégrées aux systèmes d’acquisition ou financiers. Le Secrétariat du Conseil du Trésor du Canada révisera la liste des ministères et agences faisant une déclaration selon l’Annexe E de façon continue afin d’inclure les autres ministères lorsqu’ils auront acquis les fonctionnalités nécessaires.

4.4 Surveillance de la divulgation proactive
4.4.1

Conformément au paragraphe 4.1.2.13 de la Directive sur la gestion de l’approvisionnement, les cadres supérieurs désignés du ministère chargé de la gestion de l’approvisionnement assument les responsabilités suivantes :

veiller à ce que l’information sur les marchés soit exacte (notamment l’information divulguée publiquement dans le Portail du gouvernement ouvert), dans la mesure où son importance relative établit qu’il est rentable de le faire;
veiller à ce que l’information sur les marchés demeure représentative de l’activité contractuelle réelle;
valider et approuver la publication opportune de l’information sur les marchés."
5. Références,"Lois pertinentes

Loi sur l’accès à l’information
Loi fédérale sur la responsabilité
Loi sur la gestion des finances publiques
Règlement sur les marchés de l’État

Politiques du Conseil du Trésor

Politique sur la planification et la gestion des investissements
Directive sur la gestion de l’approvisionnement (qui remplace la Politique sur les marchés abrogée à compter du 13 mai 2022)
Politique sur les marchés
Directive sur les normes comptables : GC 5000 Inscription des opérations financières dans les comptes du Canada

Normes du Conseil du Trésor

Norme sur l’accessibilité des sites Web
Norme relative au fichier fournisseur"
6. Demandes de renseignements,"6.1

Si vous avez des questions sur le présent instrument de politique, veuillez communiquer avec Demandes de renseignements du public du SCT."
