New column 0,New column 1
5. Application des outils de politique du Conseil du Trésor,"Lorsqu'ils appliquent les outils de politique du Conseil du Trésor et dans l'exercice de toutes leurs fonctions, les fonctionnaires doivent incarner les valeurs et afficher le comportement que préconise le Code de valeurs et d'éthique de la fonction publique. Les ministères utilisent les outils de politique en observant les quatre mêmes principes de reddition de comptes efficace utilisés pour l'élaboration des outils de politique, qui ont été examinés à la section 3.2. Bien que leurs exigences varient selon le sujet traité, la plupart des outils de politique ont en commun un certain nombre d'exigences générales que les administrateurs généraux doivent mettre en place pour que leur ministère puisse réaliser les résultats attendus et les objectifs. Ces exigences générales sont expliquées dans la présente section.

Le Conseil du Trésor et le SCT doivent également s'assurer que les outils de politique sont utilisés; des explications à ce sujet figurent ci-dessous.

5.1 Rôles, responsabilités et attentes en matière de rendement clairs

L'établissement de rôles, de responsabilités et d'attentes en matière de rendement clairs comprend les trois étapes suivantes :

tous les gestionnaires et employés savent que les outils de politique définissent leurs fonctions respectives et celles de l'ensemble du ministère, et ils ont tous reçu une formation à cet égard;
les exigences établies dans les outils de politique obligatoires servent à définir les responsabilités des administrateurs généraux, des gestionnaires et des experts fonctionnels, s'il y a lieu. Lorsqu'ils attribuent les responsabilités, les administrateurs généraux doivent s'efforcer de déléguer les pouvoirs décisionnels au niveau approprié de l'organisation de manière à obtenir des résultats;
de même, les objectifs et les résultats escomptés établis dans les outils de politique obligatoires servent à établir des attentes raisonnables en matière de rendement pour les individus et les unités organisationnelles.
5.2 Attentes qui tiennent compte des moyens disponibles pour y répondre

En plus de l'exigence concernant la formation des employés (ci-dessus), les trois exigences générales suivantes aident à établir les moyens dont dispose le ministère pour répondre aux attentes :

des ressources suffisantes sont affectées et utilisées efficacement pour appliquer les outils de politique du Conseil du Trésor;
des processus et des systèmes appropriés ont été établis pour organiser et contrôler les activités;
Des renseignements de qualité sur les activités liées aux politiques sont recueillis et utilisés pour faire connaître les décisions prises, surveiller la conformité aux exigences des outils de politique, évaluer les résultats, améliorer continuellement les pratiques de gestion et présenter un compte rendu juste et fiable au moyen de rapports.
5.3 Rapports

Les rapports sont l'un des principaux moyens qu'utilisent les ministères pour respecter leur engagement à l'égard de la valeur de la transparence de la fonction publique. Grâce aux rapports, le Conseil du Trésor, le Parlement et le public peuvent examiner les succès et les échecs des gestionnaires d'un ministère. Les rapports sont aussi le moyen utilisé par les ministères pour démontrer leur conformité aux politiques et aux lois, permettant ainsi une surveillance et supervision appropriées.

Bien que les exigences et mécanismes de préparation de rapports puissent varier d'une politique à l'autre, il est essentiel que les principes de la responsabilité efficace énoncés dans le présent Cadre soient respectés. Les rapports découlant des politiques sont élaborés en consultation avec les ministères afin de s'assurer qu'ils répondent avec efficience aux besoins des décideurs et est propice à un gouvernement responsable. Pour ce faire, les centres stratégiques doivent respecter les principes suivants au moment de fixer les exigences de préparation de rapports :

Les exigences de préparation de rapports doivent respecter des responsabilités de supervision et des obligations redditionnelles des administrateurs généraux;
Les exigences de préparation de rapports doivent avoir un objectif clair;
Les exigences de préparation de rapports doivent permettre de trouver en temps opportun l'information pertinente pour atteindre cet objectif;
Les exigences de préparation de rapports devraient être efficientes  le coût de production des rapports et de communication des renseignements devrait être minime;
Les exigences de préparation de rapports doivent tirer parti des sources de données existantes, sans faire double emploi avec d'autres exigences.
5.4 Surveillance et conséquences

5.4.1 Surveillance

Les ministères et le Conseil du Trésor ont chacun des responsabilités de supervision. Il incombe aux ministres et aux administrateurs généraux de surveiller l'application des politiques dans leur ministère. De son côté, le Conseil du Trésor, avec l'aide du SCT, surveille l'application des politiques à l'échelle de l'administration fédérale. (Il convient de noter qu'il incombe aussi au Conseil du Trésor de surveiller les dépenses de l'État, mais le présent document ne porte pas sur cette question).

Les ministres et les administrateurs généraux doivent pouvoir compter sur une bonne expertise de la gestion et un solide système de contrôles pour s'acquitter de leur responsabilité en matière de surveillance. La vérification interne et l'évaluation des programmes sont des exemples de deux activités clés dans le domaine de la surveillance, et le Conseil du Trésor a établi des politiques qui fixent des normes minimales de conduite pour ces activités.

L'autre outil de surveillance clé est le cadre de responsabilisation de gestion, qui décrit les dix conditions générales et interdépendantes en matière de gestion que les administrateurs généraux doivent créer dans leur ministère. Le CRG sert à évaluer le rendement global des gestionnaires. On évalue le rendement par rapport à chacun des éléments du CRG au moyen d'indicateurs qui sont établis en partie en fonction des exigences les plus importantes et du niveau le plus élevé contenues dans les politiques du Conseil du Trésor. Cette intégration des attentes à l'égard du CRG et des exigences des politiques du Conseil du Trésor renforce le fait que le CRG et les politiques se complètent et se soutiennent mutuellement – ils sont tous deux nécessaires à la gestion des ministères.

Si des questions non résolues se posaient au sujet de l'interprétation d'un outil de politique, les ministères devraient entrer en contact avec le SCT, pour obtenir une interprétation préalable afin de clarifier la question. Si celle-ci demeure non résolue ou si un différend survient, le ministère peut demander au Conseil du Trésor de prendre une décision au sujet de l'interprétation et de l'application de l'outil de politique.

Le Conseil du Trésor remplit sa fonction de surveillance d'une manière qui respecte les obligations redditionnelles qui incombent aux ministres et aux administrateurs généraux en matière de gestion. Le Conseil du Trésor surveille la conformité aux politiques, le maintien des systèmes de contrôle interne et, selon une évaluation du risque, certaines activités ministérielles. Pour remplir ce rôle de surveillance, il s'appuie sur un certain nombre de sources telles que les vérifications ministérielles, les évaluations de programme, les rapports ministériels sur le rendement, les présentations au Conseil du Trésor, les rapports présentés au Conseil du Trésor conformément aux exigences des politiques, les rapports du Bureau du vérificateur général, les Comptes publics et les discussions tenues avec les fonctionnaires à tous les niveaux. Tous ces renseignements sont recueillis et examinés par le SCT et classés par rapport aux 10 éléments du CRG. Les renseignements servent ensuite à mettre à jour les outils de politique et à faire connaître les discussions tenues avec les administrateurs généraux concernant le rendement de leurs gestionnaires.

La Loi sur la gestion des finances publiques (article 16.5) définit un mécanisme de règlement des différends pour traiter les questions non réglées concernant l'interprétation ou l'application d'un instrument de politique du CT. Ce nouveau mécanisme s'applique uniquement aux ministres et aux administrateurs des comptes dont les organisations sont énumérées aux Parties I et II de l'Annexe VI de la LGFP. Dans un tel cas, l'administrateur des comptes doit envoyer une lettre au secrétaire du Conseil du Trésor, avec une copie à son ou sa ministre, pour demander des instructions écrites sur la question.

Si le différend persiste après la réception des instructions écrites du secrétaire du Conseil du Trésor, le ministre responsable doit renvoyer la question au Conseil du Trésor pour qu'une décision soit prise. Le renvoi doit être fait dans le cadre d'une présentation au Conseil du Trésor signée par le ministre responsable. Une copie de la décision du Conseil du Trésor sera communiquée à la vérificatrice générale à titre de document confidentiel du Conseil privé de la Reine.

5.4.2 Conséquences

Les mesures que prend un ministère pour assurer l'application des politiques du Conseil du Trésor auront une incidence considérable sur la relation de travail qui existera entre chaque ministère et le Conseil du Trésor. Le niveau de surveillance qu'exercera le Conseil du Trésor sera principalement fonction du régime de gestion et de surveillance du ministère et des mesures qu'il prendra pour résoudre les problèmes de non-conformité.

Lorsqu'une politique n'est pas observée, les causes profondes et les circonstances ayant mené à la dérogation sont rarement simples. Plusieurs facteurs entrent souvent en ligne de compte. Il peut s'agir d'un manque de connaissances, d'une surveillance insuffisante, de politiques et de règlements difficiles à interpréter ou à appliquer et, dans de rares cas, de gestes délibérés nécessitant des mesures disciplinaires. Le rôle que joue la procédure d'enquête dans la détermination des mesures correctives ou disciplinaires à prendre dépend de la mesure dans laquelle l'action ou l'inaction de certaines personnes ou de certains ministères a contribué à la non-observation de la politique.

La décision du Conseil du Trésor de prendre d'autres mesures ou d'intervenir dans les cas de non-conformité (c.-à-d. ayant des conséquences négatives pour les ministères) dépend du degré de risque en cause dans le problème de gestion à résoudre. Les interventions peuvent revêtir diverses formes, y compris un suivi officieux, des demandes de renseignements précis ou des rapports supplémentaires, des vérifications externes ou d'autres enquêtes, une orientation officielle quant aux mesures préventives ou correctives à prendre par le ministère et le retrait du pouvoir.

Il incombe aux administrateurs généraux de mettre en œuvre les mesures correctrices appropriées dans leur ministère (y compris des mesures ayant des conséquences négatives pour les individus). Ces mesures devraient aussi réduire la probabilité de réapparition d'une situation analogue. Par souci d'uniformité dans l'approche du gouvernement à l'égard de la non-conformité aux politiques, les politiques du Conseil du Trésor indiqueront les conséquences possibles pour les ministères et, dans certains cas, pour les individus."
