New column 0,New column 1
6. Références,"Lois
Loi sur la gestion des finances publiques, articles 2, 19, 21, 29.1, 29.2, 33, 34 et 39 et paragraphe 32(1)
Loi sur la protection des renseignements personnels
Loi sur les fonds renouvelables
Loi sur les frais de service
Loi sur les levés et l’inventaire des ressources naturelles
Règlement de 1997 sur le remboursement de recettes
Instruments de politique et de directives connexes
Directive sur la délégation des pouvoirs de dépenser et des pouvoirs financiers
Directive sur les normes comptables : GC 4100 Comptes à fins déterminées
Directive sur les paiements de transfert
Directive sur l’imputation et les autorisations financières spéciales
Guide de délégation et de mise en uvre des pouvoirs de dépenser et des pouvoirs financiers
Guide de l’estimation des coûts
Manuel de comptabilité du gouvernement du Canada
Manuel de comptabilité selon la SIF, sous-sections 9.1.4 et 9.9
« Normes comptables du secteur public » et « lignes directrices en matière de comptabilité du secteur public »
Note de bas de page
6Politique sur la gestion financière
Politique sur les résultats
Politique sur les services communs
Présentations au Conseil du Trésor
Receveur général
Directive du receveur général 2009-2, « Exigences pour la création de comptes à fins déterminées dans le cadre des comptes du Canada »"
7. Demandes de renseignements,"Les membres du public peuvent communiquer avec le personnel chargé des demandes de renseignements du Secrétariat du Conseil du Trésor du Canada s’ils ont des questions au sujet du présent guide.

Les employés des ministères devraient communiquer avec le groupe responsable des politiques financières de leur ministère s’ils ont des questions au sujet du présent guide.

Les employés du groupe responsable des politiques financières au sein des ministères peuvent communiquer avec le personnel chargé des Demandes de renseignements concernant la gestion financière en ce qui concerne l’interprétation du présent guide."
