New column 0,New column 1
1. Date de publication,Le présent guide a été publié le 22 novembre 2019.
"2. Application, objet et portée","Le présent guide s’applique aux organisations énumérées à la section 6 de la Politique sur la gestion financière.

Le présent guide fournit des renseignements au sujet des :

imputations internes entre ministères;
autorisations financières spéciales qui permettent de dépenser les recettes et les fonds versés au Trésor.

Le présent guide appuie la Directive sur l’imputation et les autorisations financières spéciales (la directive) en :

fournissant des renseignements précis sur la façon de répondre aux exigences de la directive;
recommandant les meilleures pratiques pour la mise en œuvre de la directive.



Le présent guide complète la directive; il ne présente pas de nouvelles exigences obligatoires. Il contient des exemples à titre d’illustration et des conseils qui peuvent ne pas s’appliquer à tous les ministères ou à toutes les situations.

Le présent guide ne s’applique pas à l’établissement des frais selon la définition figurant dans les dispositions de la Loi sur les frais de service. Toutefois, la section 5 du présent guide traite des recettes provenant des frais perçus."
3. Aperçu,"La fonction d’imputation interne comprend l’établissement des coûts, l’imputation et le recouvrement des dépenses engagées dans la fourniture de biens ou de services entre les ministères au sein du gouvernement du Canada.

En général, toutes les recettes et les rentrées de fonds doivent être créditées au Trésor, sauf lorsque les ministères ont des autorisations financières spéciales, y compris les suivantes :

le ministère a l’autorisation de dépenser les recettes (soit un fonds renouvelable ou des recettes nettes en vertu d’un crédit), comme le montre la figure 1;
les fonds ont été reçus à des fins particulières et sont assujettis à l’article 21 de la Loi sur la gestion des finances publiques;
les rentrées de fonds peuvent être imputées au crédit en vertu de l’article 39 de la Loi sur la gestion des finances publiques;
les fonds reçus proviennent d’un autre ministère et seront utilisés pour exécuter un programme au nom de ce ministère (c’est-à-dire un crédit à un compte d’attente d’un autre ministère).

Figure 1 - Schéma des recettes, des rentrées de fonds et des dépenses recouvrables

Figure 1 - Version textuelle :

Remarque - L’autorisation relative aux fonds renouvelables et l’autorisation relative aux revenus nets en vertu d’un crédit peuvent être accordées par une loi de crédits selon l’article 29.1 de la Loi sur la gestion des finances publiques. C’est en pratique la façon la plus courante d’obtenir les revenus nets en vertu d’un crédit. L’autorisation relative aux fonds renouvelables et l’autorisation relative aux revenus nets en vertu d’un crédit peuvent également être accordées par la loi habilitante d’un ministère ou, dans le cas d’une autorisation relative aux fonds renouvelables, par la Loi sur les fonds renouvelables."
4. Types d’imputation interne,"La présente section fournit des instructions sur les 2 types d’imputation interne au sein du gouvernement du Canada et les exigences générales relatives à leur administration :

les imputations internes pour les services intégrés (sous-section 4.1);
les imputations internes lors d’une collaboration (sous-section 4.2);
les exigences administratives relatives aux imputations internes (sous-section 4.3).
4.1 Imputations internes pour les services intégrés

Les sous-sections 4.4 et 4.5 de la directive énumèrent les exigences en matière d’imputation interne pour les services intégrés.

4.1.1
Services intégrés

Les services intégrés (qui comprennent les services communs) sont des services offerts par les ministères qui ont le mandat de fournir des services aux autres ministères. Les services intégrés peuvent être obligatoires ou facultatifs. Voir la Politique sur les services communs pour plus d’informations.

4.1.2
Organisation des services intégrés

Une organisation de services intégrés (qui comprend un fournisseur de services communs) est une organisation ou un ministère désigné comme fournisseur central de services particuliers aux ministères.

4.1.3
Autorisation d’imputer des frais

Seules les organisations des services intégrés peuvent fournir des services intégrés aux ministères clients et les imputer. L’autorisation d’imputer des frais pour des services intégrés doit également être conforme au mandat et aux priorités du ministère (voir la sous-section 4.5.1 de la directive). L’autorisation d’imputer des frais n’autorise pas automatiquement la dépense des recettes tirées de ces frais. Les ministères doivent avoir l’autorisation du Parlement pour dépenser les recettes perçues.

Voir la section 5 du présent guide pour obtenir des renseignements sur les autorisations financières spéciales pouvant être obtenues pour dépenser les recettes perçues.

4.1.4
Frais interministériels pour les services intégrés

En conformité avec les sous-sections 4.4.1, 4.4.2, 4.5.1 et 4.5.2 de la directive, les ministères doivent :

estimer le coût de la prestation du service intégré;
veiller à ce que le montant à imputer ne dépasse pas l’estimation approuvée (c’est-à-dire, le coût estimé de la prestation du service intégré);
veiller à ce que les frais exigés soient raisonnables (c’est-à-dire, le coût estimé est le montant maximum à imputer, mais il est possible d’envisager un montant inférieur en fonction d’autres facteurs);
présenter la méthode d’établissement des coûts utilisée et la détermination des taux lorsque l’approbation du Conseil du Trésor est requise.



De plus amples renseignements sont disponibles dans les Lignes directrices sur l’établissement des coûts.

4.2 Imputations internes lors d’une collaboration

Les sous-sections 4.6 et 4.7 de la directive énumèrent les exigences en matière d’imputation interne lors d’une collaboration avec un autre ministère. Ces exigences s’appliquent à tout ministère qui fournit des services de soutien internes comme il est défini dans l’article 29.2 de la Loi sur la gestion des finances publiques.

4.2.1
mputation interne pour les services de soutien internes en vertu de l’article 29.2 de la Loi sur la gestion des finances publiques

Selon l’article 29.2 de la Loi sur la gestion des finances publiques, les ministères peuvent fournir des services de soutien internes à d’autres ministères et en recevoir de ceux-ci. Les services de soutien internes sont des services administratifs qui sont fournis pour appuyer un ministère ou un programme. Ils ne comprennent pas les services fournis directement au public.

Voici les services de soutien internes, selon le paragraphe 29.2(4) de la Loi sur la gestion des finances publiques :

les services de gestion des ressources humaines;
les services de gestion financière;
les services de gestion de l’information;
les services de technologie de l’information;
les services en matière de communications;
les services des biens immobiliers;
les services du matériel;
les services des acquisitions;
les autres services administratifs désignés par décret.



Certains services peuvent ne pas être fournis selon l’article 29.2 de la Loi sur la gestion des finances publiques. En vertu du paragraphe 29.2(3) de la Loi sur la gestion des finances publiques, un ministère n’est pas autorisé à fournir des services si, en vertu d’une loi fédérale, d’un décret ou d’instructions du Conseil du Trésor :

ces services peuvent être fournis que par un autre ministère ou organisme, y compris les situations où un ministère ou un organisme a été reconnu comme le seul fournisseur fédéral d’un service (d’autres ministères doivent obtenir le service du fournisseur reconnu ou d’une source à l’extérieur du gouvernement fédéral);
les ministères sont tenus d’obtenir des services obligatoires des organisations de services intégrés, conformément à la décision ou à l’instrument de politique du Conseil du Trésor (les ministères qui ne sont pas des organisations de services intégrés ne peuvent pas fournir ces services);
il est interdit au ministère de fournir des services de soutien internes.
4.2.2
Frais interministériels pour les services intégrés internes

En conformité avec la sous-section 4.6.1 de la directive, les frais interministériels sont imposés pour recouvrer les coûts différentiels engagés dans la prestation de services de soutien internes à d’autres ministères.

En conformité avec la sous-section 4.6.1.1 de la directive, les frais peuvent faire l’objet d’une dispense dans le cadre d’une entente lorsque les coûts de prestation de services à un ministère sont minimes.

4.2.3
Autorisation de dépenser les recettes

L’article 29.2 de la Loi sur la gestion des finances publiques ne donne pas l’autorisation de dépenser les recettes. Les ministères ont besoin d’une autorisation législative pour dépenser les recettes provenant de la prestation de services de soutien internes afin de compenser les dépenses engagées dans la prestation des services en question (appelé l’autorisation de dépenser les recettes).

Lorsqu’un ministère obtient ou prévoit obtenir des recettes provenant de la prestation de services de soutien internes, et qu’il compte dépenser la totalité ou une partie des recettes, mais qu’il n’a pas l’autorisation législative
Note de bas de page
1 de le faire, il doit obtenir annuellement l’autorisation du Parlement pour pouvoir dépenser la totalité ou une partie des recettes conformément :

à l’alinéa 29.1(2)a) de la Loi sur la gestion des finances publiques;
aux exigences relatives aux revenus nets en vertu d’un crédit définies dans la directive.



Quelques ministères ont l’autorisation en vertu de leur loi habilitante de dépenser les recettes tirées de leurs activités.

De même, le paragraphe 29.1(1) de la Loi sur la gestion des finances publiques autorise un établissement public
Note de bas de page
2 à dépenser les recettes tirées de ses activités.

Les ministères qui souhaitent obtenir une autorisation de dépenser les recettes tirées de la prestation de services de soutien internes peuvent communiquer avec leur analyste du secteur des programmes au Secrétariat du Conseil du Trésor pour obtenir des conseils.

4.2.4
Autorisation relative aux renseignements personnels

L’autorisation de fournir des services de soutien internes aux autres ministères et d’en recevoir d’eux donne implicitement l’autorisation de fournir et de recevoir les renseignements personnels nécessaires pour fournir les services. Il incombe aux ministères de respecter les exigences de la Loi sur la protection des renseignements personnels ainsi que les politiques et directives connexes sur la protection des renseignements personnels chaque fois qu’ils communiquent des renseignements personnels.

4.3 Exigences administratives relatives aux imputations internes
4.3.1
Exigence d’une entente écrite

Une entente écrite doit être conclue entre les ministères avant de fournir les biens ou les services. Une entente écrite doit normalement comprendre les éléments suivants :

une description des services à fournir;
des rôles et responsabilités clairement définis;
les mécanismes de prise de décisions et de résolution des différends;
la durée de l’entente et l’avis nécessaire pour le retrait ou la cessation;
les niveaux de service et les attentes liées au rendement convenus;
le fondement qui sous-tend l’imputation des services fournis, les modalités de facturation et de règlement des comptes ainsi que les renseignements qui seront fournis pour appuyer les frais;
les types de renseignements personnels à recueillir et à communiquer en vertu de l’entente et les fins auxquelles les renseignements seront utilisés (cette information est seulement nécessaire lorsque des renseignements personnels sont recueillis).
4.3.2
Facturation transparente

En conformité avec les sous-sections 4.5.4 et 4.7.4 de la directive, les factures envoyées aux ministères clients doivent contenir suffisamment de détails pour appuyer l’attestation selon l’article 34 de la Loi sur la gestion des finances publiques.

Les renseignements contenus dans la facture doivent aider la personne investie du pouvoir délégué à vérifier et à documenter si les travaux ont été exécutés, les biens ont été fournis ou les services ont été rendus conformément à l’entente (voir la sous-section A.2.2.1.7 de l’annexe A, de la Directive sur la délégation des pouvoirs de dépenser et des pouvoirs financiers). Cette information peut comprendre :

une description détaillée du service fourni (par exemple les services fournis et les éléments facturés et la date précise à laquelle le service a été fourni ou la période de temps pendant laquelle il l’a été);
le montant total dû;
une ventilation détaillée des coûts des services (dont le volume et le coût unitaire, s’il y a lieu) et des éléments facturés pendant la période;
toute autre information pertinente qui pourrait aider la personne investie du pouvoir délégué d’attestation à vérifier les renseignements de la facture (article 34 de la Loi sur la gestion des finances publiques)."
