New column 0,New column 1
5. Types d’autorisations de suppression de dettes accordées en vertu de la LGFP,"La présente section indique les autorisations de suppression de dettes prévues dans la LGFP et la façon dont elles peuvent être appliquées dans la pratique. L’annexe B comprend un arbre de décision sur la suppression de dettes qui peut servir d’étape préliminaire pour déterminer l’autorisation appropriée de suppression de dettes qui peut être utilisée. De plus amples renseignements sur l’application des autorisations de suppression des dettes en vertu de la LGFP sont fournies à l’annexe C.

5.1 Radiation de dettes

La radiation de dettes en vertu de l’article 25 de la LGFP comprend l’élimination d’une dette en tout ou en partie des comptes du Canada (par exemple, les grands livres des comptes débiteurs et le calendrier chronologique). Elle n’éteint pas légalement la dette ou l’obligation. L’État conserve ainsi ses droits de percevoir ou de recouvrer la dette ultérieurement et la dette pourrait être rétablie à tout moment, sous réserve des délais de prescription applicables. Les seules exceptions sont les règlements à l’amiable, ou lorsqu’un paiement actualisé a été accepté comme règlement complet de la dette. Dans ces cas, le débiteur est libéré de toute obligation de payer le solde (c’est-à-dire que la dette est éteinte) en vertu de l’entente conclue avec le débiteur.

Les dettes budgétaires et non budgétaires peuvent être radiées. Toutefois, selon le Règlement sur la radiation des créances (1994), la radiation de dettes est réservée aux dettes suivantes :

les dettes qui sont jugées irrécouvrables;
les dettes pour lesquelles les dépenses administratives ou d’autres coûts de recouvrement de la dette ne sont pas justifiés par rapport au montant de la dette ou dans les cas où il existe un règlement à l’amiable ou un paiement actualisé est accepté.
5.1.1 Autorisation de radier des dettes

Les exigences du Règlement et de la LGFP doivent être respectées avant qu’une dette puisse être radiée. Il y a différentes exigences selon que la dette est liée au salaire ou non et qu’elle est budgétaire ou non budgétaire.

La dette budgétaire non salariale comprend les montants dus à l’État qui ne sont pas associés à des dépenses liées aux salaires ou à des avances liées à l’emploi (comme une avance de voyage). Cette dette peut comprendre les montants dus à l’État à la suite de la vente de biens, de la prestation de services ou de l’utilisation d’installations.

Une dette budgétaire non salariale peut être radiée (y compris tout intérêt impayé connexe) en vertu de l’article 4 du Règlement, conformément au paragraphe 4(2) ou 4(3) ou à l’article 6. L’approbation du Conseil du Trésor n’est pas requise pour radier une dette budgétaire non liée aux salaires.

Les dettes salariales budgétaires et les avances comptables comprennent les montants dus à l’État en raison de trop-payés salariaux et d’indemnités liées à l’emploi qui ont été versés à un employé ainsi que les avances comptables telles qu’elles sont définies dans le Règlement sur les avances comptables. Ces avances peuvent constituer des montants versés à un employé qui est payé à un taux de rémunération incorrect ainsi que le solde impayé d’une avance de voyage non utilisée accordée à un employé.

Les dettes budgétaires liées au salaire et les avances comptables (et tout intérêt impayé connexe) peuvent être radiées en vertu de l’article 4 du Règlement, conformément au paragraphe 4(2) ou 4(3) ou à l’article 6. Toutefois, ces dettes sont également assujetties à l’exigence supplémentaire énoncée au paragraphe 5(1) du Règlement, qui prévoit que l’approbation du Conseil du Trésor est requise.

Toutefois, tel qu’il est énoncé au paragraphe 5(2) du Règlement, l’approbation du Conseil du Trésor n’est pas requise si la dette de l’employé a été découverte après la cessation de son emploi et après le paiement de toutes les prestations de cessation d’emploi.

Les avances, les prêts et les investissements non budgétaires sont composés de montants dus à l’État en raison d’un prêt, d’une avance ou d’un investissement. Il peut s’agir, par exemple, de prêts consentis dans le cadre d’un programme ministériel qui accorde une aide financière aux Canadiens à des fins précises.

Les dettes salariales non budgétaires et les avances comptables (et tout intérêt impayé connexe) peuvent être radiées en vertu de l’article 4 du Règlement conformément aux paragraphes 4(2) ou 4(3) ou 6 (par exemple, si un débiteur ne rembourse pas une partie ou la totalité d’un prêt, d’une avance ou d’un investissement). Toutefois, ces dettes sont également assujetties à l’exigence supplémentaire énoncée au paragraphe 25(2) de la LGFP. En vertu du paragraphe 25(2) de la LGFP, les dettes non budgétaires doivent être incluses à titre de dépenses budgétaires dans une loi de crédits (autrement dit, un nouveau crédit budgétaire doit être créé dans le Budget des dépenses) ou dans toute autre loi du Parlement avant d’être radiées. Dans la pratique, le nouveau crédit budgétaire est le plus souvent inclus dans une loi de crédits. L’approbation du Conseil du Trésor doit inclure le montant de la dette et les intérêts impayés connexes dans une loi de crédits.

5.1.2 Dans quelles circonstances une dette peut-elle être radiée?

L’autorisation de radier une dette découle de l’article 4 du Règlement sur la radiation des créances (1994) et prévoit que la totalité ou une partie d’une dette peut être radiée si une ou plusieurs des situations ci-dessous existent.

La dette a été jugée irrécouvrable : Le paragraphe 4(1) s’applique lorsqu’une dette est considérée comme irrécouvrable et que tous les critères suivants prévus à l’article 6 du Règlement sur la radiation des créances (1994) sont remplis :
Il est démontré que le recouvrement de la dette a échoué après que toutes les mesures raisonnables ont été prises pour recouvrer la créance et que tous les moyens possibles de recouvrement ont été épuisés.
Il n’y a aucune possibilité de recouvrements supplémentaires par compensation des montants futurs qui seraient dus au débiteur (par exemple, un remboursement de l’impôt sur le revenu ou tout autre paiement émis par le gouvernement).
Il n’y a pas d’autres moyens d’appliquer d’autres mesures de recouvrement et au moins l’une des neuf conditions énumérées à l’alinéa 6c) s’applique. Ces conditions comprennent notamment les suivantes : le débiteur est décédé et il n’y a pas de succession, le débiteur a fait faillite et la dette est considérée comme frappée de prescription.

Il est important de noter que si aucun effort de recouvrement n’a été fait, la dette ne peut pas être radiée en vertu du paragraphe 4(1) du Règlement, sauf si des mesures de recouvrement ne sont pas possibles ou sont déraisonnables. Dans ce contexte, le terme « déraisonnable » fait habituellement référence à des mesures exceptionnelles (comme l’ouverture de procédures judiciaires dans des administrations étrangères). Dans la plupart des cas, la demande à un débiteur de payer une dette impayée ne serait pas considérée comme une mesure de recouvrement déraisonnable.

Le coût de recouvrement de la dette l’emporte sur le montant de la dette ou sur la probabilité de recouvrement : Le paragraphe 4(2) s’applique lorsque le coût de recouvrement de la dette (par exemple, les frais juridiques et les frais d’agence de recouvrement) est supérieur au montant de la dette qui pourrait être recouvrée. Dans l’exercice de cette autorisation, les ministères doivent disposer d’une analyse coûts-avantages rigoureuse qui documente et justifie l’application du paragraphe 4(2).
Le ministère a convenu d’un règlement complet de la dette selon la valeur actualisée : L’alinéa 4(3)a) s’applique lorsqu’un paiement actualisé a été accepté comme règlement complet de la dette. Le débiteur est libéré de toute obligation de payer le solde (autrement dit, la dette est éteinte) et le solde de la dette peut ensuite être radié. De plus amples renseignements à ce sujet se trouvent à la section 7.2.6 du Guide de gestion des comptes débiteurs.

Il y a un règlement à l’amiable de la dette : L’alinéa 4(3)b) s’applique lorsque le débiteur a négocié un règlement à l’amiable avec le gouvernement en vertu d’une autorisation applicable, en vertu duquel il est tenu de rembourser uniquement une partie de la dette due (ou qui éteint la dette). Les règlements à l’amiable sont appropriés seulement si le coût du litige l’emporte sur le montant qui devrait être recouvré. Si d’autres facteurs motivent la décision, la remise ou la renonciation est plus appropriée.

Lorsqu’un règlement à l’amiable est conclu, le débiteur est libéré de toute obligation de payer le solde (autrement dit, la dette est éteinte) et le solde de la dette est alors admissible à la radiation. De plus amples renseignements à ce sujet se trouvent à la section 7.2.7 du Guide de gestion des comptes débiteurs.

Il est fortement recommandé que les ministères consultent leur unité de services juridiques lorsqu’ils envisagent de négocier un règlement à l’amiable.

Il convient de noter que les exigences du Règlement ont trait à la recouvrabilité de la dette. Une radiation de celle-ci en vertu du Règlement n’est pas appropriée si la raison pour laquelle la dette n’est pas recouvrée est que le recouvrement serait considéré comme déraisonnable, injuste ou à l’encontre de l’intérêt public. D’autres moyens de suppression de dettes (par exemple, la remise ou la renonciation) sont possibles dans de tels cas.

5.1.3 Surveillance de la radiation des dettes
Procédures de contrôle et de radiation d’une dette

Les articles 7 et 8 du Règlement prévoient les procédures à suivre pour contrôler et radier une dette.

Toutes les dettes doivent être contrôlées au moyen de rapports réguliers à la direction (y compris le solde, l’ancienneté, le montant recouvré à ce jour, les intérêts courus ainsi que les renseignements et les risques de crédit) et dans les comptes appropriés du ministère jusqu’à ce qu’elles soient recouvrées ou radiées.
Un processus d’examen officiel doit être établi par le ministre ou l’administrateur général compétent au nom du ministre.
Si le montant à radier est supérieur à 25 000 $ (ou tout autre seuil inférieur fixé par le ministre ou l’administrateur général du ministère), il doit être renvoyé à un comité d’examen qui formulera ensuite des recommandations au ministre (ou à tout autre représentant autorisé par le ministre) sur la radiation proposée.
Le comité d’examen est composé d’au moins trois fonctionnaires publics, dont au moins un n’a pas participé à l’établissement ou au calcul de la créance ni aux mesures prises en vue de son recouvrement.
Conservation des renseignements et dossiers

L’article 9 du Règlement porte sur les exigences de conservation des documents pour les dettes radiées. Tous les renseignements et dossiers doivent être conservés jusqu’à ce que :

les procédures de vérification et les autres exigences administratives se rapportant à la radiation de la créance soient terminées;
les probabilités de compensation soient nulles;
le délai de prescription pour intenter une action en justice en vue de la détermination du montant de la créance ou de son recouvrement soit expiré.
5.2 Remise de dettes

La remise d’une dette en vertu de l’article 23 de la LGFP éteint légalement la dette (y compris tout intérêt impayé connexe), abolit le droit de l’État de rétablir la dette et permet à l’État et au débiteur de retirer définitivement la dette de ses comptes.

La remise de dettes en vertu de l’article 23 de la LGFP concerne une vaste catégorie de dettes, mais exclut les dépenses non budgétaires. Les dépenses non budgétaires peuvent faire l’objet d’une renonciation en vertu de l’article 24.1 de la LGFP (ou d’une radiation en vertu de l’article 25 de la LGFP, le cas échéant).

Les dettes d’une société d’État envers un ministère peuvent également faire l’objet d’une renonciation en vertu de l’article 24.1 de la LGFP. Toutefois, les dettes budgétaires d’une société d’État ne sont pas expressément exclues de l’application de l’article 23 de la LGFP. Par conséquent, les dettes budgétaires des sociétés d’État peuvent faire l’objet d’une renonciation en vertu de l’article 24.1 de la LGFP ou d’un décret de remise en vertu de l’article 23 de la LGFP.

Une remise est opérationnalisée par un décret publié dans la partie II de la Gazette du Canada. Par conséquent, les remises peuvent établir un précédent du point de vue des politiques, et une justification est nécessaire pour chaque décision (par exemple, si deux dettes de nature similaire sont assujetties à un traitement différent); autrement, la décision pourrait sembler arbitraire et faire l’objet d’une contestation judiciaire.

5.2.1 Dans quelles circonstances une dette peut-elle être remise?

En vertu de l’article 23 de la LGFP, les remises ne s’appliquent qu’aux dettes budgétaires, y compris :

les impôts, les pénalités et les intérêts connexes;
d’autres dettes (y compris celles liées ou non au salaire) et les intérêts connexes.

L’article 23 de la LGFP énonce également les critères en vertu desquels une dette peut être remise. Ces critères comprennent des situations dans lesquelles le recouvrement des montants serait considéré comme :

déraisonnable ou injuste, ce qui peut s’appliquer dans les cas suivants :
raisons de compassion (difficultés financières importantes);
équité (iniquité résultant d’erreurs);
considérations législatives ou réglementaires (anticipation d’une modification de la loi);
considérations politiques (injustice ou résultats inattendus);
à l’encontre de l’intérêt public, ce qui concerne habituellement des relations fédérales‑provinciales, ou des relations avec des groupes autochtones ou des éléments qui ont des répercussions plus importantes sur les relations publiques ou les politiques publiques plutôt que sur une personne en particulier.
5.2.2 Autorisation de faire remise d’une dette

L’article 23 de la LGFP prévoit que les impôts, les pénalités et les intérêts connexes peuvent faire l’objet d’une remise par le gouverneur en conseil sur recommandation du ministre compétent. Une présentation au gouverneur en conseil est requise. D’autres dettes et intérêts connexes peuvent faire l’objet d’une remise par le gouverneur en conseil suivant la recommandatio“ n du Conseil du Trésor.

Lorsqu’une recommandation du Conseil du Trésor est requise, les ministères doivent préparer une présentation au Conseil du Trésor et une présentation au gouverneur en conseil. Ensuite, le décret et la note explicative connexe doivent être publiés dans la partie II de la Gazette du Canada.

5.3 Renonciation à une dette

La renonciation en vertu de l’article 24.1 de la LGFP éteint légalement la dette (et tout intérêt impayé connexe), abolit le droit de l’État de rétablir la dette et permet à l’État et au débiteur de retirer définitivement la dette de ses comptes.

La renonciation à une dette ne s’applique qu’à des dettes non budgétaires et aux dettes d’une société d’État envers un ministère. Avant qu’une dette non budgétaire fasse l’objet d’une renonciation, un crédit budgétaire doit être imputé pour le montant de la dette et les intérêts correspondants.

5.3.1 Dans quelles circonstances une dette peut-elle faire l’objet d’une renonciation?

La LGFP ne prévoit aucun critère précis pour déterminer les modalités d’une renonciation à une dette, car la décision de renoncer à une dette relève du Parlement, et le Parlement doit avoir le pouvoir de le faire dans les circonstances qu’il juge appropriées. Toutefois, dans la pratique, les ministères qui souhaitent renoncer à une dette devraient se fonder sur les critères de remise prévus à l’article 23 de la LGFP (c’est-à-dire que le recouvrement serait déraisonnable, injuste ou à l’encontre de l’intérêt public au sens de l’article 5.2.1 de ce guide).

5.3.2 Autorisation de renoncer à une dette

La renonciation prévue à l’article 24.1 de la LGFP exige l’approbation du Parlement par l’intermédiaire d’une loi de crédits ou de toute autre loi du Parlement. Dans la pratique, la renonciation est le plus souvent incluse dans une loi de crédits. L’approbation du Conseil du Trésor doit inclure le montant de la dette et les intérêts impayés connexes dans une loi de crédits.

La renonciation prévue à l’article 24.1 de la LGFP peut être utilisée pour les types de dettes suivants :

La dette non budgétaire qui est définie comme une dette incluse dans l’état de l’actif et du passif lorsque la renonciation constituerait une imputation à un crédit budgétaire d’un ministère – par exemple, il peut s’agir de prêts, d’avances ou d’investissements impayés dus à un ministère ou de dettes non budgétaires d’une société d’État envers un ministère.
Une dette budgétaire d’une société d’État envers un ministère – par exemple, un ministère peut offrir des services pour lesquels des frais sont facturés à tous les utilisateurs, comme les particuliers et les sociétés d’État. Si les services utilisés et fournis pour générer les droits étaient payés par des fonds budgétaires (des dépenses votées au moyen de crédits), tous les frais dus au ministère par la société d’État seraient considérés comme une dette budgétaire.
5.4 Dispense ou réduction des intérêts et/ou des frais administratifs

Le ministre compétent (ou tout fonctionnaire public autorisé par écrit par lui) peut accorder une dispense ou une réduction des intérêts et/ou des frais administratifs liés aux effets non honorés (par exemple, les chèques sans provision) ou réduire ceux-ci dans certaines situations, conformément aux articles 9 et 12 du Règlement sur les intérêts et les frais administratifs. Des renseignements supplémentaires se trouvent à la section 9 du Guide sur les intérêts et les frais administratifs."
