New column 0,New column 1
6. Éléments particuliers à prendre en considération,"6.1 Accumulation d’intérêts sur les comptes débiteurs en souffrance

Le Règlement sur les intérêts et les frais administratifs élaboré en vertu du paragraphe 155.1(6) de la LGFP prescrit les taux et les conditions générales selon lesquels les ministères doivent percevoir des intérêts sur les dettes non fiscales en souffrance et imposer des frais administratifs lorsqu’un instrument payable par un particulier ou une entreprise à l’État n’est pas honoré (par exemple, chèque refusé pour insuffisance de fonds).

Le Règlement sur les intérêts et les frais administratifs s’applique lorsqu’il n’existe aucun autre règlement, contrat, loi, décret ou entente régissant le paiement d’intérêts à l’État. Lorsqu’un instrument ne renferme aucune disposition concernant le paiement des intérêts pour les comptes en souffrance ou les paiements tardifs, le Règlement s’applique automatiquement. Lorsque seul le Règlement s’applique, les intérêts doivent être accumulés sur les dettes en souffrance à compter de leur date d’échéance (sous réserve des exceptions applicables).

Dans certaines circonstances limitées, les intérêts courus ou les frais administratifs imposés en vertu du Règlement peuvent faire l’objet d’une dispense ou être réduits. Lorsqu’une dispense n’est pas possible, la dette peut être supprimée en mobilisant l’une des autres autorités de suppression de dettes mentionnées ci-dessus, le cas échéant.

Des lignes directrices détaillées concernant l’application du Règlement sur les intérêts et les frais administratifs sont fournies dans le Guide sur les intérêts et les frais administratifs.

6.2 Les seuils des sommes de peu de valeur sont-ils applicables?

Les sommes dues à l’État sont assujetties aux dispositions concernant les sommes de peu de valeur énoncées à l’article 155.2 de la LGFP et dans le Règlement sur les sommes de peu de valeur. Le Règlement a une application générale et a habituellement préséance sur toute autre loi, tout règlement, tout contrat ou tout arrangement, à quelques exceptions près (par exemple, les dettes en vertu de la Loi de l’impôt sur le revenu, de la Loi sur la taxe d’accise et les sommes dues à des sociétés d’État par des personnes autres que l’État).

Le Règlement prescrit que tout montant dû à l’État dont la valeur est inférieure à 2 $ (sauf les exceptions prévues dans le Règlement sur les sommes de peu de valeur) est réputé nul. Dans ces cas, aucun mécanisme de suppression de la dette n’est nécessaire parce que la dette est simplement réputée avoir une valeur de zéro.

Des lignes directrices détaillées concernant l’application de l’article 155.2 de la LGFP et du Règlement sur les sommes de peu de valeur se trouvent dans le Guide sur l’application des sommes de peu de valeur.

6.3 Source de fonds

Une source de fonds est nécessaire pour s’assurer que toutes les entrées et les sorties de fonds du Trésor sont comptabilisées comme il se doit. La suppression d’une dette a une incidence financière directe sur le gouvernement fédéral parce que les entrées de trésorerie seront maintenant inférieures aux prévisions initiales. Par conséquent, quelle que soit la nature de la dette (par exemple, budgétaire ou non budgétaire) ou l’autorisation de suppression de la dette utilisée, une source de fonds sera nécessaire dans la plupart des cas lorsqu’une dette est supprimée pour compenser le montant dans le cadre financier.

La source de fonds par défaut est le niveau de référence de l’organisation. En règle générale, la source de fonds est confirmée par l’établissement d’une allocation bloquée non reportable qui équivaut au montant de la dette supprimée. De plus amples renseignements sur les affectations bloquées permanentes se trouvent sur la page Autorisations couramment demandées du Secrétariat du Conseil du Trésor du Canada (SCT). Si une organisation n’est pas en mesure de gérer cette pression au moyen de ses niveaux de référence actuels, elle devrait communiquer avec son analyste de programme au SCT pour discuter des options, qui pourraient comprendre une demande de source centrale de fonds fournie par une décision de financement.

Une source de fonds ne doit pas être considérée par erreur comme une provision pour dettes douteuses ou dettes irrécouvrables qui sont des éléments distincts basés sur la comptabilité d’exercice et fondés sur les estimations d’un ministère quant aux créances qui ne sont pas recouvrables. L’objectif d’une source de fonds est de réserver des fonds dans le cadre financier, tandis qu’une provision pour créances douteuses ou mauvaises n’accomplit pas la même chose. De plus, l’analyse de la source de fonds est indépendante de la création d’un nouveau crédit dans le Budget des dépenses, ce qui est nécessaire pour supprimer une dette non budgétaire. La création d’un nouveau crédit est une exigence légale visant à obtenir l’approbation du Parlement et n’a aucune incidence directe sur les fonds.

6.4 Paiements de transfert

Dans les cas où un programme de paiements de transfert peut créer un retour de fonds qui pourrait entraîner l’établissement d’une créance dans les comptes du Canada en vertu des règles comptables applicables énoncées dans le Manuel de comptabilité selon la SIF, il est recommandé que les ministères analysent chaque cas individuellement avant de conclure des ententes de financement. Cette analyse devrait être effectuée en consultation avec le centre d’expertise sur les paiements de transfert du ministère, son unité des services juridiques et son équipe des opérations comptables afin de déterminer s’il y aura une dette d’un point de vue juridique et les autorisations disponibles pour une suppression éventuelle.

6.5 Limites des délais de prescription

Bien que le Conseil du Trésor ne fixe pas de délai pour recouvrer les dettes, une dette peut être frappée d’une prescription en vertu de l’article 32 de la Loi sur la responsabilité civile de l’État et le contentieux administratif. En vertu de la Loi sur la responsabilité civile de l’État et le contentieux administratif, à moins qu’un autre délai n’ait été prévu dans la législation fédérale, l’État dispose d’un délai de six ans après qu’une dette eut été contractée (et non pas à sa découverte) pour prendre des mesures de recouvrement lorsque la dette survient ailleurs que dans une province. Lorsque la dette survient dans une province, les délais de prescription provinciaux s’appliquent, lesquels peuvent être plus courts (par exemple, deux ou trois ans).

Bien que certaines mesures puissent encore être prises pour recouvrer une dette après l’expiration du délai de prescription, elles n’ont pas force exécutoire. Par conséquent, certaines mesures comme l’ouverture d’une procédure judiciaire et la compensation peuvent ne pas être applicables.

Étant donné la complexité juridique de la détermination et de l’application des délais de prescription, les services juridiques ministériels devraient être consultés afin de déterminer la période applicable à chaque situation, y compris les modalités de la remise en vigueur du délai de prescription, et d’éviter que les dettes ne soient frappées de prescription.

6.6 Droits et autres charges dus aux ministères

De nombreux ministères facturent des frais pour les services qu’ils offrent (par exemple, des frais de service) ou à la suite d’autres activités liées à leurs activités (par exemple, les loyers). Les frais, loyers ou autres frais dus au ministère sont comptabilisés comme dettes jusqu’à ce qu’ils soient entièrement recouvrés. Ces dettes seront généralement budgétaires parce que les coûts engagés pour générer les recettes sont le plus souvent financés au moyen de crédits de fonctionnement.

La réduction ou la dispense des frais et autres charges dus au ministère sera généralement considérée comme une opération de suppression de dettes lorsqu’une remise ou une radiation peut être effectuée, comme le prévoit la LGFP. Cette remise de dette ne doit pas être confondue avec les remises requises en vertu de la Loi sur les frais de service qui s’appliquent à différents scénarios et qui sont également assujetties à des critères distincts. En outre, d’autres lois du Parlement peuvent autoriser le versement, la réduction ou l’annulation des frais particuliers. Ces autorisations sont appliquées indépendamment des dispositions de la LGFP relatives à la suppression de dettes et elles peuvent aussi suivre un ensemble différent de critères à ceux qui sont énoncés dans le présent guide.

6.7 Suppression du déficit accumulé d’un fonds renouvelable

Les fonds renouvelables sont une autorisation financière précise utilisé par quelques ministères lorsqu’un programme est entièrement ou partiellement financé par des recettes et que les opérations ont un caractère cyclique significatif (par exemple, années excédentaires servent à financer les années déficitaires).

Dans certains cas, un fonds renouvelable peut se trouver dans une situation de déficitaire et, après qu’une analyse approfondie de celui-ci a été effectuée, il se trouvera incapable de s’équilibrer au cours de son cycle d’activité à la suite d’un événement inattendu (par exemple, des chocs ponctuels, une demande imprévisible et des exigences changeantes). Dans ces cas, le ministère voudra peut-être supprimer tout ou partie du solde du déficit accumulé du fonds afin de rétablir entièrement ou partiellement son pouvoir de prélèvement. Cette suppression peut être demandée dans le Budget principal des dépenses ou le Budget supplémentaire des dépenses après l’approbation du Conseil du Trésor et nécessitera la détermination d’une source de fonds. Pour de plus amples renseignements sur ce processus, les ministères doivent communiquer avec leur analyste de programme au SCT.

Bien que ce processus puisse être qualifié de « radiation » ou de « renonciation » dans d’autres documents (par exemple, les anciennes politiques du Conseil du Trésor), il ne faut pas confondre ce processus avec les autorisations décrites dans le présent guide qui traitent de la suppression de dettes. Un déficit accumulé d’un fonds renouvelable n’est pas une dette due à l’État et la suppression du solde serait effectuée en vertu des autorisations prévues par la Directive sur l’imputation et les autorisations financières spéciales et d’autres articles pertinents de la LGFP."
7. Comptabilisation et déclaration des opérations de suppression de dettes,"La suppression d’une dette entraîne la suppression du montant des comptes du Canada. La comptabilisation et la déclaration de la suppression de la dette peuvent varier selon que la dette est budgétaire ou non budgétaire et détermineront si une imputation sur un crédit est nécessaire.

La déclaration supplémentaire des suppressions de dettes se trouve à la section 2 du volume III des Comptes publics. Cette exigence de déclaration découle de l’article 24.2 de la LGFP pour la renonciation, du paragraphe 24(2) de la LGFP pour les remises et du paragraphe 25(4) de la LGFP pour les radiations.

Pour obtenir des lignes directrices sur la comptabilisation des opérations de suppression de dettes, consultez la section sur les suppressions de dettes du Manuel de comptabilité selon la SIF."
8. Références,"Lois et règlements
Loi sur la gestion des finances publiques
Règlement sur la radiation de créances (1994)
Règlement sur les intérêts et les frais administratifs
Loi sur la faillite et l’insolvabilité
Loi de l’impôt sur le revenu
Loi sur les frais de service
Règlement sur les sommes de peu de valeur
Règlement sur les avances comptables
Loi sur la responsabilité civile de l’État et le contentieux administratif
Instrument de politique et lignes directrices connexes
Politique sur la gestion financière
Directive sur la gestion des fonds publics et des comptes débiteurs
Guide de gestion des comptes débiteurs
Guide sur les intérêts et les frais administratifs
Guide sur l’application des sommes de peu de valeur
Autorisations couramment demandées
Manuel de comptabilité selon la SIF
Directive sur l’imputation et les autorisations financières spéciales"
9. Demandes de renseignements,"Les membres du public peuvent communiquer avec l’équipe des Demandes de renseignements du Secrétariat du Conseil du Trésor du Canada pour toute question liée au présent guide.

Les employés des ministères devraient communiquer avec leur groupe ministériel de la politique financière pour toute question liée au présent guide.

Les employés du groupe ministériel de la politique financière peuvent communiquer avec l’équipe des Demandes de renseignements sur la gestion financière en ce qui concerne l’interprétation du présent guide."
