New column 0,New column 1
1. Date de publication,Le présent guide a été publié le 31 mars 2021.
"2. Application, objet et portée","Le présent guide s’applique aux organisations énumérées à la section 6 de la Politique sur la gestion financière et aux dettes découlant des comptes débiteurs tels qu’ils sont définis dans la Directive sur la gestion des fonds publics et des comptes débiteurs.

Le présent guide a pour but de fournir aux ministères des renseignements sur la suppression de dettes envers l’État, conformément à la Loi sur la gestion des finances publiques (LGFP).

Le présent guide appuie les autorisations de suppression de dettes prévues dans la LGFP sous les quatre formes suivantes de suppression de dettes :

radiation en vertu de l’article 25 de la LGFP et du Règlement sur la radiation des créances (1994);
remise en vertu de l’article 23 de la LGFP;
renonciation en vertu de l’article 24.1 de la LGFP;
dispense ou réduction des intérêts et/ou des frais administratifs en vertu de l’article 155.1 de la LGFP et des articles 9 et 12 du Règlement sur les intérêts et les frais administratifs.

Le présent guide complète la loi, les règlements et la directive. Il ne présente pas de nouvelles exigences obligatoires.

Le présent guide ne traite pas des éléments suivants :

les dettes découlant de créances comptabilisées à la suite d’erreurs de saisie dans la comptabilité ou les dettes sans fondement juridique – les ajustements requis aux comptes débiteurs d’un ministère en raison d’erreurs de saisie sont de nature administrative et ne nécessitent pas d’autorisation législative ou réglementaire;
d’autres lois fédérales (par exemple, la Loi sur la faillite et l’insolvabilité, la Loi de l’impôt sur le revenu et la Loi sur les frais de service) qui confèrent aux ministres ou à une entité le pouvoir d’approuver la radiation, la remise ou la renonciation de dettes, d’obligations ou de réclamations particulières (qui peuvent comprendre des conditions autres que celles énoncées dans la LGFP et/ou le Règlement sur la radiation des créances (1994)).

La section 3 présente le contexte qui a conduit à l’adoption des contrôles requis dans le processus de suppression de dettes.

La section 4 donne des détails sur la façon dont les dettes sont définies et classées au sein du gouvernement du Canada.

La section 5 traite des différentes autorisations de suppression de dettes prévues par la LGFP.

La section 6 porte sur les éléments particuliers à prendre en considération concernant la suppression de dettes :

l’accumulation d’intérêts sur les comptes débiteurs en souffrance;
l’application du Règlement sur les sommes de peu de valeur ;
la source de fonds;
les paiements de transfert;
les limites des délais de prescription;
les droits et autres charges dus aux ministères;
la suppression du déficit accumulé d’un fonds renouvelable.

La section 7 porte sur la comptabilisation et la déclaration des opérations de suppression de dettes.

L’annexe A présente un résumé des divers mécanismes de suppression de dettes.

L’annexe B illustre un arbre de décision sur la suppression de dettes.

L’annexe C contient des renseignements supplémentaires concernant l’application des autorisations de suppression de dettes en vertu de la LGFP"
3. Contexte,"La dette due à l’État résulte d’une grande variété de transactions entre le gouvernement et des parties extérieures. Il peut s’agir de comptes débiteurs fiscaux et non fiscaux ainsi que de sommes dues sur des prêts, des placements et des avances consentis par le gouvernement. Lorsqu’il est déterminé que la dette ne peut pas être entièrement réglée (par exemple, elle est jugée irrécouvrable, déraisonnable, injuste, ou à l’encontre de l’intérêt public), les ministères doivent prendre des mesures en temps opportun pour s’assurer que les montants sont supprimés des comptes du Canada.

Il existe un système détaillé des contrôles législatifs et réglementaires qui doit être suivi pour s’assurer que :

le processus de suppression de dettes est géré avec diligence raisonnable;
les comptes débiteurs ne sont pas retirés des comptes du Canada sans suivre le processus approprié.

Divers mécanismes de suppression de dettes sont prévus dans les lois relatives aux programmes en vertu desquelles la dette a été créée (par exemple, la Loi de l’impôt sur le revenu) ou dans la LGFP. Pour obtenir de plus amples renseignements sur l’application de certaines lois relatives aux programmes, les ministères peuvent consulter leur unité des services juridiques.

Il convient de noter que l’option de radiation des dettes est réservée aux dettes suivantes :

les dettes qui sont jugées irrécouvrables;
les dettes pour lesquelles les dépenses administratives de recouvrement ne seraient pas justifiées par rapport au montant de la dette;
les cas où il existe un règlement à l’amiable pour la dette, ou lorsqu’un paiement actualisé a été accepté comme règlement complet de la dette.

Étant donné que les exigences du Règlement sur la radiation des créances (1994) ont trait à la recouvrabilité de la dette, la radiation de la dette en vertu du Règlement n’est pas appropriée si la raison pour laquelle la dette n’est pas recouvrée est que le recouvrement serait considéré comme déraisonnable, injuste ou à l’encontre de l’intérêt public. D’autres moyens de suppression de dettes (par exemple, la remise ou la renonciation) sont possibles dans de tels cas.

D’autres lignes directrices sont fournies à la section 5."
4. Définition et classification de la dette,"La présente section présente la définition d’une dette due à l’État, précise quand les autorisations de suppression de dettes en vertu de la LGFP s’appliqueraient et explique comment les dettes sont classées au sein du gouvernement du Canada.

La dette est généralement définie comme une obligation envers Sa Majesté ou une réclamation de Sa Majesté.

4.1 Quand les autorisations de suppression de dettes accordées en vertu de la LGFP s’appliquent‑elles?

La figure 1 résume l’application des autorisations de suppression de dettes accordées en vertu de la LGFP (c’est-à-dire les montants qui seraient considérés comme une dette envers l’État par rapport aux montants qui ne sont pas considérés comme une dette envers l’État). Des explications de la figure 1 se trouvent aux sous-sections 4.1.1 et 4.1.2.

Figure 1 : Application des autorisations de suppression de dettes en vertu de la LGFP
Figure 1 - Version textuelle
4.1.1 Application des autorisations de suppression de dettes en vertu de la LGFP

Les montants suivants seraient généralement considérés comme des dettes envers l’État et seraient donc assujettis aux autorisations de suppression de dettes prévues dans la LGFP :

créances des particuliers, des sociétés et des organisations : les autorisations de suppression de dettes en vertu de la LGFP s’appliquent aux montants dus aux ministères par des particuliers (y compris les paiements en trop non recouvrés aux employés relativement aux salaires ou à toute autre indemnité liée à l’emploi), des sociétés et des organisations. La définition de « ministère » se trouve à l’article 2 de la LGFP.
créances des sociétés d’État (société non-mandataire): les autorisations de suppression de dettes en vertu de la LGFP s’appliquent aux montants dus à un ministère par une société d’État qui n’est pas une société mandataire. Les définitions de « société d’État » et de « société mandataire » se trouvent à l’article 83 de la LGFP. Une société d’État est désignée comme une société non-mandataire dans ce guide.
créances des gouvernements provinciaux, territoriaux ou étrangers : les autorisations de suppression de dettes s’appliquent également aux montants dus à un ministère par un gouvernement provincial, territorial ou étranger.

Il est fortement recommandé que les ministères consultent leur unité de services juridiques pour déterminer si leur situation serait assujettie aux autorisations de suppression de dettes en vertu de la LGFP ou s’il y a une autre loi du Parlement qui s’appliquerait.

4.1.2 Quand les autorisations de suppression de dettes en vertu de la LGFP ne s’appliqueraient‑elles pas?

Les montants suivants ne seraient pas considérés comme des dettes envers l’État et ne seraient donc pas assujettis aux autorisations de suppression de dettes prévues dans la LGFP :

opérations interministérielles : Les autorisations de suppression de dettes en vertu de la LGFP ne s’appliquent pas aux comptes débiteurs interministériels. Tout montant qu’un ministère doit recevoir d’un autre ministère n’est pas considéré comme une dette envers l’État puisqu’il s’agit d’une opération interne (autrement dit, il n’y a pas d’incidence nette ou de « nouvelle » dette créée envers l’État en raison de ces créances).
créances des ministères : Les autorisations de suppression de dettes en vertu de la LGFP ne s’appliquent pas lorsqu’un ministère doit des sommes à des tiers, par exemple pour le paiement de factures de fournisseurs ou le paiement de salaires aux employés. Ces opérations ne créent pas de dette envers l’État puisqu’elles concernent des paiements effectués par l’État.
4.2 Types de dettes

Lorsqu’une dette est supprimée en vertu de la LGFP, les ministères doivent d’abord déterminer le type d’opération financière qui a généré la dette. Il existe deux types d’opérations : budgétaire et non budgétaire. En général, toutes les dépenses doivent être approuvées par le Parlement et le classement de la dette dans ces deux catégories permet de s’assurer que l’autorisation appropriée est obtenue pour toutes les dépenses. La distinction entre les dettes budgétaires et les dettes non budgétaires reflète la nature des dépenses et ne découle pas de la comptabilité d’exercice. Dans les deux cas, l’opération peut donner lieu à un actif financier aux fins de la comptabilité financière. Des explications supplémentaires se trouvent aux sous‑sections 4.2.1 et 4.2.2.

4.2.1 Dette budgétaire

Les opérations budgétaires ont une incidence sur l’excédent et le déficit annuels du gouvernement. Les montants dus aux ministères en raison d’opérations budgétaires sont, en règle générale, des dettes découlant d’activités ministérielles financées par des crédits budgétaires approuvés en vertu d’une loi de crédits (par exemple, les crédits pour dépenses de fonctionnement, paiements de transfert ou dépenses en capital) ou au moyen d’une autorisation législative accordée en vertu d’une loi donnée. Ces montants peuvent inclure des montants liés au salaire et des montants non liés au salaire.

En d’autres termes, une dette budgétaire découle habituellement des opérations normales du gouvernement qui sont financées par des crédits pour dépenses (par exemple, les frais payables, les taxes ou les montants à recevoir en vertu d’un contrat) ou lorsque des fonds issus d’un crédit pour dépenses n’étaient généralement pas censés être remboursés au ministère, mais deviennent remboursables à l’avenir (par exemple, un trop-payé salarial).

4.2.2 Dette non budgétaire

Les opérations non budgétaires ont une incidence sur la composition des actifs financiers du gouvernement. En règle générale, il s’agit de prêts, d’investissements et d’avances. L’autorisation peut être accordée par voie de crédits votés (par exemple, un crédit commençant par la lettre « L » se différencie des crédits budgétaires votés ordinaires). Comme les dettes budgétaires, ces crédits sont autorisés par une loi de crédits ou par une autorisation législative en vertu d’une loi donnée. Un exemple de ces types de transactions comprend (mais sans s’y limiter) un prêt qui doit être remboursé ou une avance imputée sur un compte d’avance de fonds de roulement. Un compte d’avance de fonds de roulement peut être créé en tant qu’autorisation non budgétaire par certains ministères pour financer des avances temporaires à des missions étrangères ou des employés du ministère (par exemple, salaires, avantages sociaux, frais de voyage et diverses indemnités).

Autrement dit, une dette non budgétaire est un décaissement d’argent qui ne provient pas d’un crédit pour dépenses. La dépense augmente les actifs financiers du gouvernement (par exemple, les prêts aux immigrants pour le transport et l’aide). Lorsqu’une dette non budgétaire est supprimée, l’actif financier ne sera jamais perçu. Par conséquent, il n’y aura plus de rentrée de fonds future pour le gouvernement, c’est-à-dire que les fonds ont essentiellement été dépensés. En conséquence, avant qu’une dette non budgétaire ne soit supprimée, elle doit être convertie en une dette budgétaire en l’incluant comme une dépense budgétaire dans une loi de crédit ou une autre loi du Parlement."
